video_id;title;publish_date;video_length_seconds;wiedergabezeit_minuten;durchschnittliche_wiedergabedauer;durchschnittliche_wiedergabedauer_prozent;gewonnene_abonnenten;verlorene_abonnenten;aufrufe;likes;dislikes;geteilte_inhalte;kommentare;audience_female_age18-24;audience_male_age18-24;audience_female_age25-34;audience_male_age25-34;audience_female_age35-44;audience_male_age35-44;audience_female_age45-54;audience_male_age45-54;audience_female_age55-64;audience_male_age55-64;audience_female_age65-;audience_male_age65-;audience_female_age13-17;audience_male_age13-17;Neue Zuschauer;Klicks auf Abspannelement;Klicks auf Infokartenteaser;Klicks auf Infokarte;Mag ich nicht-Bewertungen;Im Feed angezeigt;Impressionen;Klickrate der Impressionen (%);Thema;Bewertung_Titel;Gestaltung_Thumbnail
bnEMcHRp_lQ;"""Kleim zu Waffen-Freigabe für Kiew: Bidens Wende """"ist Abschiedsgeschenk und Stinkefinger"""" | ntv""";18.11.2024 10:05;130;48138;81;62,32;33,0;1;35652;355;256;172;421;1,2;5,2;2,5;12,7;3,0;12,8;3,1;11,2;5,5;14,7;9,6;18,6;;;4679,0;361;8;0;256;0;2579190;9,9;Politik;6;
F9NDItheiA4;Präventivschlag notwendig? - Reisner: Auch Israels Luftabwehr kann überwunden werden | ntv;15.04.2024 17:26;215;307027;134;62,35;87,0;3;137419;1486;212;352;397;0,1;2,2;0,5;9,4;1,0;17,7;1,3;18,7;2,1;22,4;2,9;21,6;;;13673,0;567;4;0;212;0;1535234;5,08;Krieg;7;
1D3W151yd8A;"""Rotterdam-Täter """"blutüberstromt"""" - Zeuge stellt Messerangreifer: """"Schlug ihm ins Gesicht"""" | ntv""";20.09.2024 15:50;148;137298;92;62,36;83,0;4;89257;2252;98;571;614;0,3;1,2;0,9;4,8;1,7;9,2;2,8;11,5;7,4;21,2;12,8;26,1;;;4479,0;366;0;0;98;0;1407026;5,07;Sonstiges;6;
IW4z9vHoWmQ;"""Iran spricht von """"absoluter Ruhe"""" - Video soll Israels Angriff auf Isfahan zeigen | ntv""";19.04.2024 08:07;99;10539;61;62,39;16,0;1;10237;82;27;27;50;0,3;4,1;1,2;15,2;1,9;17,4;2,5;13,9;4,0;16,8;5,7;17,3;;;1497,0;32;0;0;27;0;78900;6,93;Krieg;8;
mi4ppbbtEaM;"""""""Wird sehr chaotisch werden""""- Deutschland zittert vor weiterer Trump-Präsidentschaft | ntv""";06.11.2024 07:30;107;20723;66;62,39;18,0;0;18626;270;180;116;412;0,6;2,5;1,7;7,2;2,8;9,5;4,4;9,3;9,8;15,9;16,2;20,2;;;1815,0;223;2;0;180;0;255015;5,65;Politik;7;
STefAVhBw6w;Höchste Alarmbereitschaft für das Sommermärchen - Wie sicher ist die EURO 2024? #ntv #euro2024 #em;13.06.2024 13:10;58;20238;36;62,42;21,0;0;33543;768;29;60;53;0,7;23,7;1,5;29,1;1,8;12,6;1,8;6,9;3,8;6,8;5,1;6,2;;;3526,0;0;0;0;29;41711;361228;6,01;Sonstiges;6;
NXyhFs8K2Y0;"""""""Nicht von Israel geht Aggression aus"""" - Michael Roth (SPD) im ntv-Frühstart | #ntv #shorts #israel""";09.04.2024 14:21;54;7509;33;62,45;8,0;0;13361;195;165;34;0;0,2;2,9;0,9;9,0;0,9;12,7;1,3;14,6;3,7;22,8;7,6;23,5;;;1745,0;0;0;0;165;24826;14411;3,97;Krieg;6;
r7rHqX7Ou1c;Teurere Tickets nach Tarifeinigung bei der Bahn? Verkehrsminister Wissing im Frühstart | ntv shorts;27.03.2024 10:28;32;1079;19;62,45;2,0;0;3242;25;18;3;8;;3,3;;8,2;0,0;11,2;0,6;13,2;4,3;19,7;12,4;27,1;;;352,0;0;0;0;18;8525;8924;1,43;Wirtschaft;6;
ng1IBykFnws;Stormy Daniels spricht über angeblichen Sex mit Trump | ntv;19.03.2024 14:46;151;2690;94;62,45;0,0;0;1712;16;3;7;7;;;;10,0;;17,9;;22,5;2,7;24,9;3,0;19,0;;;311,0;6;0;0;3;0;19580;5,57;Politik;7;
OT8-cy_Fqt4;Ukraine rückt in Grenzgebiet vor - Russland erhöht Schutz von Atomkraftwerk in Kursk | ntv;08.08.2024 12:05;107;30793;66;62,49;20,0;0;27632;342;66;48;176;0,2;3,8;0,9;9,5;1,3;13,7;1,9;14,3;3,4;19,9;6,2;24,7;;;3164,0;1000;27;7;66;0;396415;4,36;Krieg;7;
mGydVwxMk-Q;Größtes Kreuzfahrtschiff der Welt sticht in See | #ntv #shorts #iconoftheseas;29.01.2024 17:03;59;1553;36;62,51;3,0;0;2527;40;8;19;0;1,3;8,0;2,0;12,6;2,7;15,6;1,4;12,2;1,5;20,3;5,8;16,5;;;1161,0;0;0;0;10;8204;11506;1,81;Sonstiges;6;
vDwxWijp73o;Himmel füllte sich mit Gleitbomben - Verteidiger nennen Gründe für den Fall von Awdijiwka  | ntv;11.03.2024 20:52;156;68932;97;62,54;14,0;1;42394;296;89;41;99;0,1;2,1;0,4;8,7;0,8;17,1;0,9;18,5;1,7;23,3;2,6;23,7;;;2426,0;186;0;0;89;0;334833;7,06;Krieg;6;
btwNtSTLd2E;"""Lena Meyer-Landrut bleibt auf Konzert-Tickets sitzen - """"Was macht man damit?"""" | ntv""";31.05.2024 08:07;130;5292;81;62,56;3,0;0;3904;57;21;14;78;1,4;1,6;3,4;8,2;5,9;17,0;5,0;16,9;8,6;18,5;5,2;8,3;;;867,0;12;0;0;21;0;22609;10,32;Sonstiges;7;
Z08zpUoJP3s;Israel sprengt erneut einen Hamas-Tunnel | #ntv #shorts #israel #gaza #palestine;30.09.2024 10:30;58;976;36;62,57;0,0;0;1615;43;6;5;5;;2,9;;10,6;;20,8;1,2;16,2;2,0;19,5;6,6;20,4;;;98,0;0;0;0;6;2494;13681;3,33;Krieg;7;
w4Y36G6Ie7I;Rechte Milizen und Bombendrohungen wühlen Springfield auf - Nach Trump-Hetze gegen Migranten | ntv;24.09.2024 11:57;119;4378;74;62,57;1,0;0;3528;73;20;12;24;;3,3;1,3;9,1;1,6;11,1;2,7;13,7;5,8;19,1;12,4;20,0;;;224,0;31;2;0;20;0;65541;3,74;Politik;6;
ZtHY9VomGtw;"""""""Ganz klassisch Mocro-Mafia"""": Explosionen in Köln - Experten sehen Zusammenhang | ntv""";18.09.2024 16:22;134;19094;83;62,65;9,0;0;13646;163;12;105;98;0,7;7,4;2,9;19,0;3,6;18,2;3,8;12,1;4,8;12,1;5,3;10,0;;;2234,0;154;0;0;12;0;175185;5,51;Sonstiges;7;
g_Qo0JoQoFA;"""Duell der Elite-Truppen in Kursk - Munz: """"Harte Kämpfe und Verluste auf beiden Seiten"""" | ntv""";16.09.2024 13:05;158;79998;98;62,65;24,0;3;48487;505;91;26;127;0,1;0,9;0,3;3,4;0,7;9,3;1,0;14,5;2,9;27,6;4,9;34,4;;;2887,0;188;0;0;91;0;473285;7,03;Krieg;6;
AYilu1tgJLM;Russland: Ukrainische Drohnen rasen in Rosneft-Ölraffinerie | #ntv #shorts #russland #ukraine;22.07.2024 12:54;50;11650;31;62,66;7,0;0;22312;258;35;18;42;;1,1;0,2;5,7;0,7;12,3;1,1;16,1;2,7;25,6;5,7;28,7;;;1658,0;0;0;0;35;32236;80637;5,79;Krieg;6;
biPKACxKD0s;"""""""Die Krim ist nicht mehr sicher"""" - Munz zu Raketenlieferungen aus den USA  | ntv""";25.04.2024 10:03;256;186777;160;62,67;64,0;5;69851;1014;142;65;182;0,1;0,5;0,3;2,6;0,6;8,1;1,3;13,1;3,3;25,9;7,3;36,8;;;5609,0;247;0;0;142;0;463649;8,92;Krieg;7;
17k9XHJWaJQ;China: Heftige Überflutungen bedrohen 127 Millionen Menschen in Guangdong | #ntv #shorts #china;22.04.2024 11:11;59;519;36;62,67;0,0;0;843;26;1;5;3;;;;;4,0;9,1;2,9;6,1;11,2;11,0;23,3;32,4;;;11,0;0;0;0;1;1232;4690;2,88;Sonstiges;6;
KdN_t9xV2lU;Wie haltet ihr es mit diesem Gebot? #ntv #doku #ostern #shorts;29.03.2024 08:00;54;3007;33;62,67;4,0;0;5333;163;24;28;10;;1,0;0,5;5,3;1,4;9,9;1,4;12,0;5,4;21,0;12,3;29,9;;;387,0;0;0;0;24;17651;15678;3,32;Sonstiges;8;
qifLvqWQduQ;"""Russische Rakete tötet Reuters-Mitarbeiter in Kramatorsk - Kiew warnt Minsk vor """"Fehler"""" | ntv""";26.08.2024 08:50;107;20109;67;62,69;8,0;0;17987;246;86;30;161;0,3;1,6;0,4;5,7;0,9;9,9;1,6;13,5;4,6;23,6;8,8;29,0;;;876,0;264;6;0;86;0;164765;7,64;Krieg;6;
WA-WMDJFUYI;"""Die #Doku """"Riskante Flughäfen - Die gefährlichsten Airports der Welt"""" gibts auf RTL+ #ntv #shorts""";23.07.2024 00:00;60;15939;37;62,76;24,0;2;25398;205;25;14;2;0,1;1,3;0,1;3,0;0,2;4,7;1,1;11,9;3,7;30,5;6,9;36,5;;1,0;1608,0;0;0;0;25;43428;30949;9,8;Sonstiges;6;
MC0OGODf8s4;Hochwasser-Fluten in Europa | #ntv #shorts #nachrichten #europe #hochwasser #regen;16.09.2024 11:52;56;4416;35;62,76;10,0;0;7539;105;11;24;9;;0,9;0,7;4,5;2,0;5,8;5,9;7,1;13,7;15,7;23,6;20,2;;;487,0;0;0;0;11;14003;53078;3,2;Sonstiges;7;
iZoN6ESUSKg;Frau zu Fuß im Flammenmeer: Rund um Los Angeles brennen die Berge | ntv;13.09.2024 15:22;101;5046;63;62,76;8,0;0;4777;56;13;18;22;;1,7;0,6;6,1;3,2;10,2;4,0;10,5;8,6;20,3;12,4;22,4;;;272,0;137;0;0;13;0;59739;3,35;Sonstiges;7;
xvHv2VHsAl4;"""""""Putin versucht, Druck auf Deutschland zu machen"""" - ntv-Reporter Munz zu Drohungen aus Kreml | ntv""";06.06.2024 09:59;187;163421;117;62,78;140,0;6;83517;946;217;177;359;0,1;0,7;0,4;2,8;1,0;7,4;1,9;11,4;4,7;23,0;10,8;35,9;;;5679,0;827;0;0;217;0;677871;5,46;Krieg;6;
Y9-5pWnOXaY;Bergwerk läuft mit Wasser voll: In Asse-Atommülllager steigt Angst vor Zwischenfall | ntv;24.05.2024 08:14;106;9529;66;62,81;2,0;0;8588;134;3;72;39;;7,1;;18,4;1,0;18,4;1,5;13,3;2,0;15,9;4,3;18,0;;;1315,0;52;0;0;3;0;78380;6,52;Sonstiges;7;
CNUNwmnkuvM;Große Explosion in russischer Waffenfabrik bei Ischewsk | ntv #shorts;08.02.2024 13:23;46;27338;28;62,88;62,0;3;56714;842;143;133;0;0,1;1,7;0,5;6,8;1,0;13,8;1,6;15,2;3,9;23,1;7,0;25,1;;1,0;3757,0;0;0;0;143;87862;34770;3,94;Krieg;7;
1ZIMwMIGtjU;Vorfall im Westjordanland: Israelische Polizisten erschießen Dreijährige | #ntv #shorts;08.01.2024 15:00;56;2230;35;62,88;3,0;0;3800;23;10;5;10;;4,3;0,7;15,9;1,2;18,6;0,5;20,0;2,4;20,0;2,2;14,1;;;603,0;0;0;0;10;7610;9401;1,76;Krieg;7;
xFHQZ6Ea21U;Erdrutsch in der Türkei: Mehrere Minenarbeiter vermisst | #ntv #shorts #türkei #erdrutsch;14.02.2024 10:35;60;2797;37;62,89;4,0;0;4449;40;7;22;0;;2,2;;4,6;0,7;5,8;1,3;8,8;7,7;18,9;17,0;33,0;;;424,0;0;0;0;7;7858;8383;3,47;Sonstiges;7;
Bg0l_K3E4_U;"""""""Politische Landschaft hat sich über Nacht verändert"""" - Blome zu Wahlen im Osten  | ntv""";02.09.2024 09:15;176;111291;110;0,0;56,0;2;60318;737;226;88;512;0,7;4,1;1,9;12,4;2,3;13,8;2,9;10,7;6,1;15,5;11,3;18,2;;;7621,0;1104;0;0;226;0;2054247;2,22;Politik;7;
miIycTKF19I;Mann stirbt nach Schuss im Frankfurter Hauptbahnhof: Tatverdächtiger gefasst | ntv;21.08.2024 13:58;69;11084;43;62,91;22,0;2;15321;147;26;111;129;1,3;4,1;3,7;10,9;4,2;11,7;6,2;11,3;8,9;13,7;11,1;12,8;;;3506,0;114;0;0;26;0;185564;4,98;Sonstiges;7;
MyddVD9vK_c;Dreck und Exkremente: Nordkorea schickt Ballons voller Unrat nach Südkorea | #ntv #shorts #korea;29.05.2024 15:08;54;1742;33;62,91;1,0;0;3077;45;7;9;0;;3,9;;12,6;;15,1;;14,3;4,0;20,0;7,8;22,5;;;265,0;0;0;0;7;5356;14062;4,15;Sonstiges;6;
N3-mRRu9Nsg;25 Jahre ntv.de | #ntv #shorts #nachrichtensender #nachrichten #geburtstag;29.05.2024 12:08;45;306;28;62,95;1,0;0;650;15;5;0;0;;;;;;16,5;;12,5;;20,2;13,3;37,5;;;11,0;0;0;0;5;1626;5154;6,6;Sonstiges;6;
t-sjsLZFN_w;Deutsche Urlauberinnen unter Todesopfern auf Mallorca - Das ist bekannt | ntv;24.05.2024 13:22;100;41751;62;62,95;34,0;2;39797;278;38;94;56;0,9;4,3;2,7;11,2;3,9;10,9;5,4;9,2;9,4;13,7;13,4;14,9;;;9000,0;1266;0;0;38;0;545275;4,98;Sonstiges;7;
RTHEsbHqgQc;Munz: Zwischen China und Russland knirscht es - Was bleibt von Putins Gipfel? | ntv;24.10.2024 11:16;148;223293;93;62,96;88,0;6;143782;1472;341;120;455;0,2;1,6;0,5;5,6;1,0;10,2;1,5;12,9;3,8;22,5;7,9;32,2;;;10399,0;1066;24;0;341;0;1352752;7,19;Krieg;8;
L8kypGjCkxM;"""Russland greift Ukraine erstmals mit neuer Hyperschall-Waffe """"Zirkon"""" an | #ntv #shorts #ukraine""";13.02.2024 15:46;60;26552;37;62,97;34,0;1;42170;394;100;85;0;0,0;1,3;0,2;4,8;0,5;10,8;1,1;15,1;3,3;26,3;6,1;30,4;;;2504,0;0;0;0;100;73750;46927;4,75;Krieg;6;
ITaYvsOmqo8;"""Munz: """"30.000 Tonnen Munition sollen explodiert sein"""" - Gewaltiger Feuer-Pilz in Russland  | ntv""";19.09.2024 13:59;184;636114;115;63,02;295,0;11;329146;4202;566;844;964;0,2;1,7;0,6;5,5;1,0;10,8;1,5;14,3;3,3;24,1;5,6;31,3;0,0;0,0;28642,0;3297;70;0;566;0;4166513;5,92;Krieg;7;
szpyRsZA7Kc;Desaster für die Ampel-Parteien zeichnet sich ab - Thüringen und Sachsen wählen | ntv;31.08.2024 10:46;146;45834;92;63,03;19,0;2;29885;496;151;61;312;0,2;2,1;0,8;6,0;1,4;9,2;2,5;11,6;6,7;21,6;12,1;25,4;;1,0;1856,0;142;4;9;151;0;377770;5,46;Politik;7;
hwCmiJcI6s0;"""""""Wir können uns auf die Bundeswehr verlassen"""" - Generalmajor Christian Freuding im Ukraine-Talk #ntv""";13.02.2024 16:06;53;33894;33;63,05;52,0;3;60854;526;354;287;0;;1,7;0,2;8,6;0,7;15,4;1,3;17,3;2,7;24,5;4,5;23,2;;;4282,0;0;0;0;354;92707;57277;4,27;Politik;7;
ehhp10s09kM;"""""""Grund, sich Sorgen zu machen"""" - Thiele zu Putins Atom-Drohungen  | ntv""";13.03.2024 14:14;200;105811;126;63,05;47,0;3;50343;550;161;119;211;0,2;1,2;0,8;5,0;1,5;12,7;2,3;15,8;4,9;23,4;7,2;24,9;;;5960,0;477;0;0;161;0;531293;5,86;Krieg;7;
042FkyUxanA;"""Ukraine-Unterstützung - """"es kommen Zweifel auf"""": US-Korrespondent Wittich zum NATO-Gipfel | ntv""";09.07.2024 13:38;109;29175;68;63,12;17,0;0;25443;200;50;24;89;0,2;0,6;0,4;2,9;0,8;6,9;1,7;10,0;6,1;21,1;14,6;34,6;;;906,0;196;0;0;50;0;210073;7,35;Krieg;7;
VuX136FqL64;Sportbälle, Plastikschuhe und Helme: All das wird in den USA an den Strand gespült | #ntv;22.11.2024 18:00;50;1422;31;63,15;2,0;0;2703;50;0;2;4;;6,6;;14,2;2,2;14,4;2,3;9,2;5,2;18,8;8,6;18,4;;;256,0;0;0;0;0;6723;18296;1,26;Sonstiges;7;
X8RkBjxH-t8;"""""""Unser Kandidat nicht qualifiziert"""": Republikaner-Bündnis stellt sich hinter Kamala Harris | ntv""";06.08.2024 10:32;114;39134;72;63,16;33,0;2;32612;548;109;138;87;0,3;4,4;1,0;7,8;1,4;8,5;2,5;10,3;5,8;20,0;11,1;26,5;;;3487,0;535;6;32;109;0;453412;4,97;Politik;6;
Gi6mFnv8heY;Kate Middleton verkündet Ende ihrer Chemotherapie - Videobotschaft in voller Länge | ntv;09.09.2024 21:20;207;55776;130;63,24;18,0;0;25566;368;10;197;41;0,4;0,2;2,8;0,5;9,1;1,8;13,8;2,2;32,9;3,9;27,8;4,6;;;8605,0;128;11;27;10;0;207838;8,83;Sonstiges;7;
3Ynl-kGMzGM;Erdogans Schatten über der EU? Politik alarmiert über deutschen AKP-Ableger | ntv;30.01.2024 09:15;87;5823;55;63,31;6,0;2;6344;113;68;126;0;0,7;4,8;1,4;12,0;2,0;11,4;3,0;10,6;7,9;12,9;14,7;18,7;;;1430,0;38;0;0;71;0;232289;2,11;Sonstiges;7;
h0w6KSQ36MU;Windrad brennt lichterloh - Greifswalder Feuerwehr schaut zu | #ntv #shorts;24.01.2024 10:29;48;12998;30;63,41;29,0;2;25623;474;64;236;0;0,5;5,8;1,4;9,0;2,4;13,9;2,1;13,9;3,6;19,9;5,3;20,5;1,0;18,0;6478,0;0;0;0;63;57774;31864;4,16;Bilder;7;
Xbfm3TRVa68;Müll am Mount Everest: Wer runterträgt, wird belohnt | #ntv;12.06.2024 13:23;111;951;70;63,43;0,0;0;811;7;0;3;8;;;;;;;;;;;;;;;145,0;21;0;0;0;0;21413;2,25;Sonstiges;8;
pWg0dFFrw4w;Limburg: Bürger stimmen für Tauben-Töten | #ntv #shorts #tauben;10.06.2024 13:18;60;3039;38;63,45;2,0;0;4791;65;17;13;30;;3,5;;12,5;0,7;14,2;1,3;12,7;5,0;22,7;5,4;22,0;;;380,0;0;0;0;17;9548;30713;3,74;Sonstiges;8;
CoHR23PWsqg;Sommerurlaub 2025 - wann ist bester Buchungszeitpunkt? - Tipps vom Reiseexperten  | ntv;11.10.2024 07:54;81;560;51;63,53;0,0;0;654;9;1;15;2;;;;;;;;;;;;;;;63,0;5;0;0;1;0;17182;2,61;Sonstiges;7;
9m4Rqz5fVOk;Feuerwehrfahrzeug überschlägt sich in NRW | #ntv #shorts #feuerwehr #unfall;26.09.2024 10:59;40;2833;25;63,58;11,0;0;6685;174;7;28;6;1,3;14,1;1,8;16,5;2,9;19,8;2,7;12,8;3,0;11,5;4,0;8,3;;15,0;836,0;0;0;0;7;10990;44147;4,46;Sonstiges;6;
_L7OCCS8pio;Was Xi und Putin sagen - und was sie verschweigen - Gipfeltreffen in Astana  | ntv;04.07.2024 11:04;114;22008;72;0,0;8,0;0;18213;206;50;38;102;0,5;4,0;1,3;12,7;2,5;15,7;2,2;12,2;4,4;16,0;7,0;21,6;;;1671,0;144;0;0;50;0;392215;2,7;Politik;7;
n7da4iYIYxU;Schnee und Eis sorgen im Süden für Verkehrschaos | #ntv;22.11.2024 12:06;56;1787;35;63,66;2,0;0;3008;71;1;19;6;;3,4;1,0;7,4;0,8;8,3;2,5;8,0;6,1;17,2;15,7;29,5;;;123,0;0;0;0;1;5284;24019;1,91;Sonstiges;7;
kFU77qJWHbg;"""""""Es ist letztlich ein Zeichen der Schwäche"""" - Jürgen Hardt, (CDU) im Frühstart | #ntv #shorts #putin""";18.03.2024 12:44;51;6826;32;63,71;9,0;1;12604;112;90;20;51;;0,6;0,2;3,1;0,5;6,8;1,7;11,7;7,4;22,5;15,4;30,0;;;379,0;0;0;0;90;19788;14828;2,65;Politik;6;
g32qWnQgnD0;Tod löst Bestürzung aus: Verletzter Polizist stirbt nach Mannheimer Messerangriff | ntv;03.06.2024 09:12;84;167582;53;63,72;247,0;9;187854;2076;378;734;1503;3,7;13,1;6,4;20,5;5,9;13,7;4,6;8,4;5,3;7,5;4,6;5,9;0,0;1,0;87431,0;2024;0;0;378;0;5471658;2,24;Sonstiges;8;
cORNMnAWdgI;Kanadier zapft versehentlich Nordkoreas Staats-TV an: Skurrile Highlights gehen viral | ntv;26.08.2024 13:59;171;166668;109;63,74;49,0;5;91741;1126;43;190;123;0,7;14,5;1,1;21,8;1,0;18,3;1,0;14,6;1,4;14,2;1,2;9,6;;1,0;7088,0;469;0;0;43;1;701454;8,67;Sonstiges;6;
SK3y0lSVw0Y;"""""""Ich habe nichts dagegen, dass Menschen freiwillig länger arbeiten"""" - Hubertus Heil (SPD) bei #ntv""";29.05.2024 12:10;58;3738;36;63,76;0,0;0;6066;131;17;3;21;;2,9;0,4;8,4;0,7;10,4;1,4;11,8;6,0;21,5;14,4;22,1;;;715,0;0;0;0;17;9401;16919;2,99;Politik;6;
XkZaaH2PzZA;Die CDU will Cannabis-Freigabe nach Wahlsieg zurücknehmen #shorts;02.04.2024 13:20;58;7396;36;63,78;6,0;0;11997;326;101;85;113;;1,5;0,4;9,3;1,5;13,5;2,1;12,7;5,4;20,1;10,7;22,8;;;522,0;0;0;0;101;15160;18220;5,1;Politik;8;
jUafHqJ_6Kg;Späher gegen Späher: Ukraine-Trupp sucht aus Versteck Ziele hinter der Front | ntv;10.05.2024 16:29;132;40914;84;0,0;14,0;2;29149;277;41;21;71;0,1;1,8;0,3;6,5;1,0;12,6;1,1;17,2;1,8;24,8;3,6;29,3;;;2353,0;130;0;0;41;0;249486;5,98;Krieg;8;
_wjMh9SQfEs;Britische Laser-Waffe könnte Ukraines Abwehrkampf befeuern | #ntv #shorts #ukraine #laser;16.04.2024 16:44;60;17276;38;63,82;20,0;0;27071;392;110;89;0;;1,2;0,1;4,2;0,3;9,7;0,6;13,5;2,2;26,3;5,4;36,7;;;1077,0;0;0;0;110;44695;93084;6,69;Krieg;8;
Vv-S415HF_M;"""""""Du bist der Idiot, der Verlierer"""" - So lief das erste TV-Duell zwischen Trump und Biden | ntv""";28.06.2024 11:07;171;258327;109;63,85;137,0;1;141958;944;247;301;562;1,2;10,7;2,4;21,4;2,5;17,9;2,4;11,6;3,7;11,2;4,8;9,9;;;45979,0;1129;0;0;247;0;5123685;2,0;Politik;6;
smRPtN7RX-I;"""""""Die Lüge hat es nicht mal fünf Sekunden weit geschafft"""" - Experte Greuel zu AfD-Aussage | ntv""";29.08.2024 12:00;78;4078;49;63,86;0,0;1;4913;155;77;37;107;;2,1;;4,3;1,5;9,3;2,6;11,9;5,5;24,4;11,6;26,8;;;90,0;31;0;0;77;0;34697;9,34;Politik;6;
3tYyiSCo5wE;Alte und neue Minister treffen nach Ampel-Aus aufeinander | ntv;12.11.2024 18:45;60;2165;38;63,87;1,0;0;3391;43;9;4;8;;;;5,2;;7,8;1,6;9,3;5,8;18,8;18,9;32,8;;;54,0;0;0;0;9;4629;29128;3,59;Politik;8;
Gx_wMX-E3Is;US-Waffe Abrams M1 enttäuscht: Sechs-Millionen-Dollar-Panzer versagt in der Ukraine | ntv;30.05.2024 22:12;145;140606;92;63,91;23,0;0;91043;654;74;153;177;0,1;3,1;0,3;8,3;0,6;16,7;0,7;18,8;1,2;25,1;1,4;23,5;;1,0;10169,0;1321;0;0;74;0;510154;11,82;Krieg;8;
Q7nwe60TTrE;USA: Private Mondmission erfolgreich von der Erde aus gestartet | #ntv #shorts #usa #nasa #odysseus;15.02.2024 13:15;60;1870;38;63,96;2,0;0;2924;70;6;10;0;;10,3;;13,1;;11,9;1,0;8,8;1,5;20,4;2,7;30,4;;;569,0;0;0;0;6;7621;17156;2,69;Sonstiges;6;
brA59Wc5M24;Zoff mit Passantin - Anzeigenhauptmeister geht zu Boden | ntv;05.04.2024 12:22;96;11396;61;0,0;9,0;3;11129;78;17;176;158;1,4;13,6;2,1;26,3;1,9;19,8;1,9;11,5;2,1;10,1;2,3;7,0;;;4727,0;0;0;0;17;0;76336;8,02;Sonstiges;8;
9NyOpUPSbE0;New York: Brücke plötzlich zu breit - Rekordhitze in New York | #ntv #shorts #newyork;10.07.2024 08:58;57;1303;36;0,0;1,0;0;2144;36;7;14;2;1,3;3,9;0,0;8,6;1,1;12,1;1,3;10,7;5,7;20,6;12,5;22,4;;;150,0;0;0;0;7;4169;12222;5,16;Sonstiges;7;
DwWnTSczrdc;Bundestag kann Prüfung beauftragen - AfD-Verbotsverfahren könnte Fahrt aufnehmen | ntv;01.10.2024 11:44;105;52285;67;0,0;35,0;4;46687;719;539;176;844;0,4;3,1;1,0;7,7;1,8;10,1;2,8;10,8;7,2;17,8;13,1;23,8;;1,0;4559,0;697;0;0;539;0;894823;3,6;Politik;7;
wpgB9hE2kvI;Wo in Europa sind Atomwaffen stationiert? | ntv;14.02.2024 15:48;137;33113;87;64,06;17,0;4;22637;228;87;148;0;0,5;7,2;1,5;14,8;1,8;15,4;2,1;13,6;3,6;15,0;6,3;18,1;;2,0;4140,0;0;0;0;87;0;385421;3,81;Sonstiges;7;
fsQSnEvdCQA;"""""""Je besser der Arbeitsmarkt, desto stabiler die Renten"""" - Arbeitsminister Hubertus Heil (SPD) #ntv""";06.03.2024 11:40;52;3101;33;64,07;2,0;0;5585;89;28;28;0;;;;1,9;0,8;4,9;1,6;10,7;6,8;28,0;11,1;34,2;;;163,0;0;0;0;28;10349;10125;1,76;Politik;6;
LK0V344Oj9M;Russland und Belarus: Militärübung für den Einsatz taktischer Atomwaffen | #ntv #shorts #russland;11.06.2024 13:18;60;13575;38;64,08;12,0;1;21186;262;90;91;43;;1,0;0,3;4,3;0,4;9,3;0,8;12,5;3,5;24,1;7,6;36,2;;;212,0;0;0;0;90;29465;38759;4,04;Krieg;7;
OR_LYiZqBxM;Wie kann man Klimaschutz gut verkaufen? #ntv #shorts #podcast;20.06.2024 10:22;34;1290;21;64,09;3,0;1;3553;25;20;8;8;;1,4;;7,8;0,9;13,5;0,7;13,4;4,0;19,6;12,6;25,9;;;132,0;0;0;0;20;5818;15652;1,96;Sonstiges;8;
8GBuCN1xcPk;Scholz liest Aufkleber vor - und kassiert Kritik | #ntv #shorts #nachrichten #olafscholz #kritik;01.03.2024 12:08;60;33062;38;64,13;32,0;2;51555;377;130;62;0;0,0;0,6;0,3;4,9;1,1;9,3;2,2;11,2;7,3;22,0;14,2;26,8;;;2589,0;0;0;0;130;61387;113250;5,26;Politik;6;
Qotm0uLQlIc;"""Raisi war wichtiger Partner - Munz: """"Der Kreml schaut ganz genau Richtung Iran"""" | ntv""";20.05.2024 10:07;86;38212;55;64,18;33,0;3;41542;293;78;58;131;0,7;6,3;1,5;13,6;2,0;12,5;2,5;11,1;5,4;15,4;9,0;19,8;;;8943,0;251;0;0;78;0;2001334;1,46;Krieg;7;
fq0PphMb1KU;Einigung scheint nicht in Sicht: Habeck veröffentlicht Videobotschaft zu Bauernprotest | ntv;08.01.2024 15:33;102;9860;65;64,23;12,0;2;9031;236;37;44;104;0,3;3,1;1,3;6,6;2,7;10,1;4,3;11,3;10,5;17,0;15,4;17,3;;;2204,0;70;0;0;37;0;162505;3,5;Politik;6;
DJJ1NlEQP9E;Polizei unterbindet Hippie-Ritualfeuer im Harz: Camper umtanzen Beamte | ntv;21.08.2024 16:28;126;14108;80;64,25;3,0;1;10456;120;31;115;94;0,7;2,6;1,5;8,2;3,0;13,1;3,8;13,5;7,5;16,8;10,7;18,7;;;1138,0;53;0;0;31;0;169340;4,26;Sonstiges;7;
oc8yM4FYBPA;Militärflugzeug rauscht haarscharf über Häuser und Köpfe | #ntv #shorts;25.01.2024 19:30;50;10386;32;64,25;11,0;1;19398;202;24;37;0;0,1;2,0;0,3;4,4;0,4;9,7;0,9;14,0;3,0;25,7;5,8;33,7;;;1505,0;0;0;0;24;37032;38315;4,05;Sonstiges;6;
6tZ_UPw0b4I;Polizei zerschlägt Kokain-Jachten-Bande | #ntv #shorts;22.07.2024 11:15;60;4263;38;0,0;6,0;0;6630;159;7;21;13;;1,8;0,4;11,2;0,7;16,8;0,7;14,0;4,2;17,6;9,3;23,3;;;230,0;0;0;0;7;9917;11943;5,57;Sonstiges;8;
x_Qv_UwCqRQ;Kolumbien: Gondelabsturz der Stadt-Seilbahn von Medellín | #ntv #shorts #medellin;27.06.2024 11:37;51;4143;32;0,0;1,0;0;7581;84;14;32;0;0,3;1,4;0,5;4,1;1,5;8,9;2,3;9,7;7,4;20,1;16,6;27,4;;;199,0;0;0;0;14;10748;9515;1,78;Sonstiges;7;
SSU75niRhsk;Sydney: Haarscharfe Bruchlandung von Kleinflugzeug | #ntv #shorts #sydney #cessna;27.05.2024 12:22;47;3651;30;64,32;1,0;1;7247;93;10;24;0;;2,7;;7,3;;10,7;0,8;13,4;2,7;21,9;7,0;33,5;;;374,0;0;0;0;10;14069;10513;1,8;Sonstiges;7;
SjKdZiiJPfs;Schlappe für Ampel in Karlsruhe - So sieht das neue Wahlrecht nach dem Urteil aus | ntv;30.07.2024 11:27;123;70200;79;64,35;24,0;2;53216;529;92;103;187;0,7;11,5;1,5;21,0;1,4;14,9;1,6;9,5;3,4;12,3;5,9;16,3;;;9764,0;322;0;10;92;0;2150915;1,7;Politik;7;
XKjQkNJLE7A;Putin lädt zum Anti-West-Gipfel nach Kasan - Mehr Wirtschaftskraft als G7  | ntv;22.10.2024 09:25;107;44393;68;64,36;50,0;6;38680;686;93;219;386;0,5;3,6;1,1;10,7;2,0;13,2;2,6;12,1;5,0;16,5;9,3;23,4;;;3285,0;517;11;0;93;0;527307;4,38;Wirtschaft;8;
Tog4Hc8P7dM;"""""""Kursk-Reaktion zeigt: Vielen Russen ist der Krieg egal"""": Munz zu Kritik und Gleichgültigkeit | ntv""";16.08.2024 15:32;178;276133;114;64,38;99,0;5;144568;1539;135;82;253;0,1;1,1;0,4;4,6;0,9;11,5;1,5;16,0;3,3;25,8;6,2;28,5;;;9674,0;1319;55;0;135;0;1491802;6,96;Krieg;7;
B3RLJDrKRYc;Kreml-Kritiker Nawalny ist tot | #ntv #shorts #russland #nawalny;16.02.2024 13:51;46;50282;29;64,38;52,0;0;101874;728;170;99;0;0,6;2,9;2,3;10,7;4,5;16,6;5,5;14,9;7,8;15,8;7,1;11,2;0,0;0,0;14549,0;0;0;0;170;204358;49691;4,3;Politik;9;
sJFKp7_FfCY;Ukrainische Drohne setzt russisches Öllager in Brand | #ntv #shorts #ukraine #russland;19.01.2024 14:30;53;5180;34;64,38;11,0;0;9109;228;36;18;0;;0,7;;2,3;0,4;7,1;0,9;11,7;3,2;25,0;9,5;39,3;;;209,0;0;0;0;36;16200;25753;2,86;Krieg;6;
eZHV7CWUKIk;"""""""Russland hat nur noch eine Wahl"""" - Munz zu Putins China-Reise  | ntv""";16.05.2024 15:07;119;119877;76;64,38;89,0;6;93880;778;463;73;394;0,3;1,7;0,6;5,5;1,0;10,0;1,8;12,6;3,8;22,2;8,2;32,2;;;9701,0;478;0;0;463;0;1137261;4,5;Krieg;9;
m0B20s5c2SU;"""""""Sonst hätten die Terroristen ihr Ziel erreicht"""" - Johannes Vogel (FDP) im #ntv Frühstart""";29.08.2024 15:30;53;1415;34;0,0;1,0;0;2488;35;8;7;8;;1,4;;5,5;;11,0;1,0;11,6;4,9;22,3;14,2;28,3;;;34,0;0;0;0;8;3804;17693;3,37;Politik;7;
Tmhzx2cctTk;"""""""Kriegsblogger: Russland kann durchaus auch verlieren"""": Munz zur Lage in Kursk | ntv""";19.08.2024 10:49;186;190900;119;64,41;77,0;3;95604;1428;254;101;383;0,1;1,2;0,4;4,4;0,8;10,5;1,2;15,1;2,9;26,4;6,1;30,8;;;6668,0;863;51;0;254;0;1034566;6,36;Krieg;7;
jqVK76nWu0Q;Heli-Crash auf Hawaii: Touristen filmen eigenen Absturz | #ntv #shorts #helikopter #hubschrauber;07.03.2024 10:28;60;6234;38;64,41;4,0;0;9679;81;11;28;0;;3,4;;12,3;1,0;17,7;1,0;16,5;2,4;22,0;4,5;19,0;;;1295,0;0;0;0;11;17442;13398;3,55;Sonstiges;6;
7jvW3XVTbuY;"""Sharma zum Angriff auf Dnipro: Ist Putins Hyperschallwaffe ein """"Gamechanger""""? | ntv""";22.11.2024 11:59;118;21655;76;64,42;14,0;2;17094;161;145;24;200;0,3;1,9;0,6;6,6;1,5;13,9;1,7;15,9;3,7;23,7;5,3;25,0;;;1282,0;246;7;0;145;0;194172;6,25;Krieg;8;
tHkz6qQFzRk;"""Krypto-Rally hat zwei Ursachen: Bitcoin-Rekorde und Dogecoin-Hype """"keine Überraschung"""" | ntv""";14.11.2024 12:09;94;4094;60;64,43;2,0;1;4057;28;2;20;6;;4,1;;30,9;1,4;32,8;1,0;16,9;;6,5;1,3;5,1;;;926,0;39;0;0;2;0;86483;2,75;Wirtschaft;6;
eYruvJNIdr8;Mindestens sieben Tote bei schwerem Erdbeben in Taiwan | ntv;03.04.2024 10:33;85;18729;54;64,44;29,0;2;20518;147;3;85;25;1,2;6,2;3,6;14,9;5,3;14,1;5,7;10,5;7,8;11,1;8,4;11,3;;;6335,0;32;0;0;3;0;444840;3,05;Sonstiges;7;
iL_XPCICrm4;Militärexperte Remmel erklärt die Bedeutung nordkoreanischer Soldaten für Russland | #ntv;28.10.2024 15:59;54;4815;34;64,44;1,0;0;8303;67;12;7;12;;0,7;0,3;2,8;0,4;5,9;1,0;7,8;3,8;20,3;12,0;44,9;;;629,0;0;0;0;12;4474;47865;1,98;Krieg;7;
Q9ebWsMWMWw;"""""""AfD Gewinnerin des Abends"""": Nikolaus Blome mit erster Einschätzung zu den Landtagswahlen | ntv""";01.09.2024 18:48;128;146741;82;64,45;75,0;5;106730;1992;243;255;770;0,6;4,3;1,4;10,6;2,0;13,7;2,9;12,4;6,2;17,5;9,7;18,5;;;12242,0;1746;0;0;243;0;2482640;2,95;Politik;6;
hDtkbmluHG4;Trump mildert NATO-Austrittsdrohung ab | #ntv #shorts #nachrichten #donaldtrump #usa #nato;20.03.2024 10:18;45;9267;29;64,47;18,0;1;19165;212;65;25;0;0,1;2,7;0,2;8,2;0,7;11,8;1,0;12,2;3,6;21,7;9,4;28,4;;;912,0;0;0;0;65;31864;22959;4,62;Politik;7;
j2LemRWdmMY;Union scheitert, Cannabis-Teillegalisierung gilt ab Ostermontag  | ntv;22.03.2024 18:23;111;27829;71;64,48;14,0;0;23331;282;73;78;242;0,5;9,9;1,8;26,1;1,9;24,7;1,9;12,0;2,7;9,0;3,2;6,4;;;6129,0;243;0;0;73;0;430181;3,72;Politik;8;
UaHvLEpWkKU;Kuriose Notlandung mitten in Baumwipfeln | ntv #flugzeug #notlandung #pilot;09.09.2024 17:16;60;5113;38;0,0;3,0;0;7928;110;6;43;4;;1,3;0,3;4,2;0,5;5,5;1,9;8,8;5,7;18,9;14,8;38,0;;;238,0;0;0;0;6;10808;38816;2,54;Sonstiges;6;
W6VaAIejac0;"""Diebstahl auf der Arbeit - ein Kavaliersdelikt? - Das gilt nach """"Tassen-Gate"""" bei Tesla  | ntv""";11.07.2024 07:41;96;1119;61;64,52;0,0;0;1085;41;3;11;13;;;;7,7;;11,4;4,3;11,1;4,6;27,4;13,4;20,0;;;60,0;4;0;0;3;0;14631;3,85;Sonstiges;6;
