video_id;title;publish_date;video_length_seconds;wiedergabezeit_minuten;durchschnittliche_wiedergabedauer;durchschnittliche_wiedergabedauer_prozent;gewonnene_abonnenten;verlorene_abonnenten;aufrufe;likes;dislikes;geteilte_inhalte;kommentare;audience_female_age18-24;audience_male_age18-24;audience_female_age25-34;audience_male_age25-34;audience_female_age35-44;audience_male_age35-44;audience_female_age45-54;audience_male_age45-54;audience_female_age55-64;audience_male_age55-64;audience_female_age65-;audience_male_age65-;audience_female_age13-17;audience_male_age13-17;Neue Zuschauer;Klicks auf Abspannelement;Klicks auf Infokartenteaser;Klicks auf Infokarte;Mag ich nicht-Bewertungen;Im Feed angezeigt;Impressionen;Klickrate der Impressionen (%);Thema;Bewertung_Titel;Gestaltung_Thumbnail
BAzlKhXkKoc;"""""""Steuer auf Milliardäre (..) wäre einfach fair"""" - Svenja Schulze (SPD) im #ntv Frühstart""";29.04.2024 10:11;18;3197;18,0;10,07;3,0;0;10584;161;60;21;45,0;0,3;1,3;0,7;6,6;1,1;10,5;1,6;12,9;5,2;23,2;11,0;25,7;;;1054,0;0;0;0;60;21434;8080,0;1,78;Politik;6,5;2
1kXX4H-yXHQ;Bärenstarker Badeausflug in Kalifornien | #ntv #shorts #bear #california #usa;19.09.2024 12:01;25;2098;25,0;10,21;1,0;0;4932;148;5;12;1,0;0,5;2,6;1,0;4,2;1,7;5,6;2,8;7,6;10,1;20,3;15,9;27,6;;;282,0;0;0;0;5;7243;13619,0;2,52;Bilder;6,5;1
zVDZ_cnZZNk;"""""""Kunst kaufen aber wie? Einsteigertipps von art-Chefredakteur Tim Sommer | #ntv #service""";16.11.2024 15:00;59;248;19,0;33,89;0,0;0;747;6;4;2;5,0;;;;14,8;;20,7;;12,8;;24,1;4,9;22,7;;;16,0;0;0;0;4;1561;15904,0;7,9;Wirtschaft;6,5;2
rtEGS21HuMM;Indien: Zug in Flammen - Passagiere schieben Waggons in Sicherheit | #ntv #shorts #india #feuer;10.06.2024 13:07;51;676;17,0;33,94;1,0;0;2345;19;1;1;6,0;;3,0;;9,2;1,4;15,9;1,3;20,4;;25,5;3,4;19,8;;;41,0;0;0;0;1;4371;13764,0;1,18;Sonstiges;6,5;1
0i4JTZsR6Uw;Sturz von Klippe - Helikopter rettet Verunglückten #ntv #shorts #kalifornien #helikopter;02.04.2024 18:06;53;3533;18,0;34,42;1,0;2;11623;91;7;5;0,0;0,5;5,1;0,8;14,7;1,6;19,3;1,4;16,0;2,6;20,1;3,6;14,2;;;1174,0;0;0;0;7;28530;13495,0;1,65;Sonstiges;6,5;1
aNanRx886Us;Kalifornien: Waldbrände vernichten Dutzende Häuser | #ntv #shorts #fire #california;06.08.2024 15:15;54;469;19,0;35,23;0,0;0;1482;17;0;3;8,0;;7,6;;14,7;3,7;16,1;;12,2;;18,1;10,2;17,3;;;111,0;0;0;0;0;4593;9710,0;1,51;Sonstiges;8,5;1
6KZBNZaUmIs;"""Taucher suchen in """"starker Strömung"""" Vermisste nach Schiffsunglück | ntv #shorts""";08.02.2024 11:07;60;1443;21,0;35,64;3,0;0;4051;44;1;1;0,0;0,6;14,6;0,8;19,3;1,8;13,7;1,5;10,7;3,1;12,5;5,6;14,2;;17,0;1201,0;0;0;0;1;7217;10427,0;1,6;Sonstiges;6,5;1
5OinYgphHKQ;Bergung des Flugzeug-Wracks in Tokio | #ntv #shorts #tokio;05.01.2024 16:00;56;1136;20,0;35,76;0,0;0;3405;40;1;1;0,0;;7,4;;13,1;;16,3;0,7;16,2;3,4;16,6;4,4;21,9;;;651,0;0;0;0;1;6684;10396,0;1,78;Sonstiges;6,5;1
X-CSlAP17ak;Brasilien: Fluss nach Lasterunfall mit Säure verschmutzt | #ntv #shorts #brasilien;31.01.2024 13:02;57;383;20,0;36,12;0,0;0;1118;10;1;3;0,0;;5,2;2,1;12,2;2,7;14,9;1,7;14,3;4,5;14,1;8,4;19,7;;;391,0;0;0;0;2;3606;9550,0;1,82;Sonstiges;6,5;1
nxhSXE1tQsM;Privatjet-Unglück in Florida: Zwei Tote nach Bruchlandung auf Autobahn | #ntv #shorts #florida;12.02.2024 12:36;60;4694;21,0;36,19;7,0;0;12973;88;15;27;0,0;0,2;1,9;0,4;4,8;1,5;10,7;2,1;14,6;5,1;26,2;8,0;24,6;;;870,0;0;0;0;15;24418;16263,0;2,33;Sonstiges;6,5;1
om7KxpPzx3I;Ausnahmezustand in Ecuador: Bewaffnete stürmen TV-Sender und Universität | #ntv #shorts #ecuador;10.01.2024 12:30;56;13873;20,0;36,81;15,0;0;40388;188;27;39;0,0;0,2;5,4;0,6;18,5;1,1;20,8;1,3;17,4;2,2;18,7;2,5;11,4;;;4413,0;0;0;0;31;107551;11608,0;2,01;Sonstiges;7,5;2
2RCKjJwwlfI;Starker Schneefall in New York: Flugzeug kommt von Landebahn ab | #ntv #shorts;19.01.2024 12:30;60;1705;22,0;37,09;1,0;0;4599;45;7;11;0,0;;4,5;0,5;6,0;0,6;10,0;1,3;11,3;3,9;23,6;8,4;30,1;;;703,0;0;0;0;7;9336;14451,0;2,36;Bilder;6,5;1
eJVkppykMb8;Iran beschießt Irak mit Raketen - mehrere Tote | #ntv #shorts #iran #irak;16.01.2024 16:30;50;1053;18,0;37,12;2,0;0;3405;38;7;2;0,0;;3,5;;7,0;;14,6;1,0;20,3;1,3;24,0;3,3;25,0;;;614,0;0;0;0;9;9003;11253,0;2,08;Krieg;6,5;1
u0zdNxVOUFo;"""""""Shell kills"""" - Klima-Aktivisten stören Shell-Aktionärsversammlung | #ntv #shell #climatechange""";22.05.2024 12:40;59;549;22,0;37,38;1,0;0;1496;25;12;2;0,0;;8,3;;16,6;;18,6;;12,8;1,8;16,6;7,6;17,6;;;108,0;0;0;0;12;3154;8354,0;2,37;Sonstiges;6,5;1
QPZb-DKZPFk;Pro-Palästina Proteste von Studierenden spalten die USA | #ntv #shorts #palestine #usa #protest;23.04.2024 15:46;60;1249;22,0;37,44;0,0;0;3338;47;9;7;0,0;;3,3;1,3;11,6;1,9;14,8;2,3;15,6;5,1;18,4;8,4;17,2;;;469,0;0;0;0;9;6931;10451,0;3,66;Politik;8,5;1
20VHakl9UYk;Bangladesch: Großbrand in Einkaufszentrum fordert viele Tote | #ntv #shorts #bangladesh #feuer;01.03.2024 10:58;57;320;21,0;37,77;0,0;0;894;9;2;5;0,0;;;;;;;;;;;;;;;31,0;0;0;0;2;2582;5900,0;1,03;Sonstiges;6,5;1
4-WBZdZ6Lys;Thailand: Tausende Motten sprengen Livestream eines Videoverkäufers | #ntv #shorts #thailand #moth;05.06.2024 12:53;60;474;22,0;37,83;1,0;0;1253;10;0;6;0,0;3,5;12,2;4,2;12,5;3,2;19,6;;15,1;3,5;10,9;5,5;9,6;;;124,0;0;0;0;0;2782;8216,0;2,23;Live;6,5;1
OepO2hxE-Co;Spanische Polizei fasst Banksy-Fälscher | #ntv #shorts #nachrichten #banksy #kunst #fälschung;08.03.2024 15:24;59;620;22,0;38,16;1,0;0;1653;18;2;5;0,0;;;0,0;5,6;;8,1;;14,1;;21,5;14,6;36,0;;;51,0;0;0;0;2;3785;12011,0;1,61;Sonstiges;8,5;1
q-K4Jeff8gs;Bei Fahrerwechsel losgerollt: Indischer Zug rast führerlos durchs Land | #ntv #shorts #indien #zug;26.02.2024 12:19;60;69246;22,0;38,18;13,0;0;181355;62;12;93;0,0;0,1;0,6;0,7;2,6;2,2;7,6;3,3;10,7;7,4;21,1;12,7;30,8;;;40750,0;0;0;0;12;9676;14187,0;4,26;Bilder;6,5;1
6NQUycAVIYs;Argentinien: Massive Proteste gegen Reformpläne der Regierung | #ntv #shorts #argentinien;02.02.2024 14:25;60;2050;23,0;38,84;0,0;0;5278;99;5;33;0,0;0,4;4,2;0,8;9,6;1,4;14,3;2,5;18,1;4,2;21,1;5,6;17,9;;;671,0;0;0;0;5;11282;12726,0;1,67;Sonstiges;6,5;1
feohZT0gsHA;Nahaufnahmen zeigen lodernde Feuer: Großbrand der Kopenhagener Börse | #ntv;17.04.2024 10:09;59;2724;23,0;39,17;2,0;0;7074;74;9;10;0,0;;4,4;;12,9;1,0;17,6;1,6;13,6;4,1;19,2;7,0;18,7;;;511,0;0;0;0;9;11577;15061,0;4,79;Bilder;6,5;1
XmYT3h2z3Vg;Tote bei Zugkollision in Indien | ntv #shorts;18.06.2024 09:37;60;572;23,0;39,37;1,0;0;1455;18;2;1;3,0;2,0;6,8;;12,8;;12,3;;8,6;4,8;13,9;10,7;28,2;;;94,0;0;0;0;2;3006;13147,0;1,23;Sonstiges;6,5;1
TqWcFc6BeUE;Achtung, besondere Fracht: Überschall-Flieger wird in New York restauriert | #ntv #shorts #concorde;14.03.2024 12:06;57;1770;22,0;39,41;3,0;0;4729;68;4;11;2,0;;2,9;;7,2;;8,6;;14,8;1,8;24,3;6,3;32,9;;12,0;473,0;0;0;0;4;8099;11291,0;2,84;Sonstiges;6,5;1
YnCei6phTvE;Paris: Flügel der Moulin-Rouge-Mühle auf Straße gestürzt | #ntv #shorts #paris #moulinrouge;25.04.2024 11:34;59;942;23,0;39,45;1,0;0;2429;26;1;8;0,0;;5,2;;11,8;3,6;14,9;4,2;10,7;6,0;16,5;9,1;18,0;;;354,0;0;0;0;1;5121;9808,0;3,53;Sonstiges;8,0;1
c6OHTpsw8SA;"""Bulldogge """"Babydog"""" stiehlt beim Republikaner-Parteitag die Show | #ntv #shorts #usa #republican""";17.07.2024 12:23;60;429;23,0;39,84;0,0;0;1077;27;4;2;4,0;3,2;8,8;2,9;14,7;;15,2;;15,2;;17,6;6,6;15,7;;;145,0;0;0;0;4;2556;7815,0;1,56;Politik;6,5;2
f9cw83yP1oE;Heldenhafte Rettung mit einem Kran! Kind wird aus brennender Wohnung befreit | #ntv #shorts #china;23.04.2024 16:32;59;1157;23,0;39,85;1,0;0;2953;44;3;0;0,0;;3,5;0,8;9,7;2,0;15,7;2,1;14,6;4,9;18,3;9,8;18,7;;;126,0;0;0;0;3;5877;5397,0;2,5;Bilder;6,5;1
AZIXh_aoh48;Riesige Stinke-Blume zieht Besucher an: Titanenwurz blüht in Kalifornien | #ntv #shorts #kalifornien;29.02.2024 11:24;60;273;23,0;39,96;0,0;0;684;10;1;3;0,0;;;;16,3;;17,6;;13,9;6,3;11,8;12,1;21,8;;;150,0;0;0;0;4;7419;12639,0;3,52;Sonstiges;7,5;2
1FAhxgJlU5M;Ewige Jugend als Trend | ntv;13.11.2024 14:57;59;948;23,0;0,0;4,0;1;2399;21;4;3;5,0;2,0;5,4;3,4;13,9;3,8;14,6;4,0;9,5;4,8;12,7;7,8;14,4;19,0;18,0;249,0;0;0;0;4;4581;13107,0;2,4;Wirtschaft;6,5;1
vXcxrrxo0L8;Philippinen: Parkplatzfeuer zerstört diverse Autos | #ntv #shorts #feuer #brand;23.04.2024 16:57;43;483;17,0;40,21;1,0;0;1679;11;3;3;0,0;;;;11,4;;17,5;3,0;16,1;4,7;24,3;6,4;16,7;;;237,0;0;0;0;3;3100;7064,0;2,35;Sonstiges;6,5;1
pr1Z3sPFuik;US-Außenminister Blinken rockt in Kiewer Bar für die freie Welt #ntv #shorts #usa #ukraine #blinken;15.05.2024 11:54;58;1200;23,0;40,29;3,0;0;3084;58;8;27;0,0;;4,4;;14,1;1,2;16,0;1,6;12,8;3,3;25,3;5,9;15,4;;;617,0;0;0;0;8;6183;18062,0;3,79;Krieg;6,5;2
3cmsWsq2UvE;Israel: Hamas beschießt israelischen Grenzort Kerem Schalom - Update: Drei Soldaten getötet | #ntv;06.05.2024 12:47;60;1314;24,0;0,0;1,0;0;3237;34;5;3;0,0;;2,9;;10,9;;12,2;0,7;15,2;2,3;22,6;5,3;27,9;;;98,0;0;0;0;5;7413;15491,0;3,71;Krieg;8,5;1
reZ-XcITyXs;Diese Bilder empören Australien: Koalas, klammern sich an Bäume, die gefällt werden #ntv #koala;21.03.2024 11:12;60;1318;24,0;40,61;1,0;0;3248;31;15;11;12,0;;;;5,9;0,7;17,6;1,0;21,5;1,9;29,5;3,8;18,2;;;152,0;0;0;0;15;6594;6671,0;4,48;Sonstiges;8,5;1
KbtaQujBAUE;Berlin: Feuerwehr löscht Brand auf Havel-Frachtschiff | #ntv #shorts #berlin #brand;11.04.2024 10:14;60;882;24,0;40,69;6,0;1;2169;42;3;6;0,0;;3,6;;12,3;;17,7;;10,7;3,2;18,6;16,4;17,5;;;316,0;0;0;0;3;5686;10057,0;2,91;Sonstiges;6,5;1
vkUczVkd5QM;Washington: SUV fährt in Tor von Weißem Haus | #ntv #shorts #whitehouse;09.01.2024 14:41;56;779;22,0;40,71;1,0;0;2051;24;2;3;0,0;;8,3;;11,7;2,1;14,4;;12,8;4,4;14,7;8,6;23,0;;;261,0;0;0;0;2;3973;8569,0;1,66;Sonstiges;6,5;1
9B8riuav6rE;Mannheim: Kleinflugzeug kollidiert bei Notlandung mit Oberleitungsmast | #ntv #shorts;02.05.2024 10:19;56;1425;22,0;40,73;1,0;0;3750;29;3;18;0,0;0,6;6,8;1,6;11,2;1,1;13,6;1,4;15,7;1,5;19,2;4,3;22,9;;;477,0;0;0;0;3;8949;9334,0;2,8;Sonstiges;6,5;1
vXSEMAxd57g;Meta-Chef Mark Zuckerberg entschuldigt sich bei Eltern | ntv shorts;01.02.2024 13:02;60;1364;24,0;40,89;3,0;0;3338;41;7;11;0,0;1,6;10,4;1,2;19,8;2,0;15,0;0,9;12,6;2,0;13,2;7,7;13,6;;;667,0;0;0;0;7;6860;10611,0;2,8;Wirtschaft;6,5;2
JXo2LHK3dKE;Bad Reichenhall: Autofahrer kracht in Tankstelle | #ntv #shorts #bayern #tankstelle #unfall;12.03.2024 16:32;52;2986;21,0;40,92;2,0;0;8422;80;6;25;8,0;;2,2;;8,5;0,7;16,7;1,1;18,0;3,3;23,3;5,4;20,9;;;395,0;0;0;0;6;13379;12274,0;2,53;Sonstiges;8,5;2
ao8dAZdPm7U;Russland: Ukrainische Drohne setzt Ölraffinerie in Brand | #ntv #shorts #russland;25.01.2024 12:46;57;11119;23,0;41,29;18,0;0;28349;427;112;41;0,0;0,1;1,9;0,3;7,4;0,6;14,0;1,3;16,9;3,2;23,7;5,9;24,7;;;1637,0;0;0;0;127;47420;25732,0;3,12;Krieg;8,5;1
aWz863zwbks;Leuchtende Meeresnacktschneckenart von Forschern identifiziert | #ntv;13.11.2024 12:40;60;323;24,0;41,32;0,0;0;784;24;0;8;0,0;;;4,1;13,4;;15,9;0,0;13,1;4,8;16,6;10,7;21,4;;;27,0;0;0;0;0;2542;9042,0;1,76;Sonstiges;6,5;1
Ld_OJXRvmyY;Nashville: Fünf Tote nach Flugzeugabsturz eines Kleinflugzeugs | #ntv #shorts #nashville;06.03.2024 11:42;59;570;24,0;41,51;0,0;0;1399;5;1;4;0,0;;;;5,3;;8,9;;16,8;3,1;17,6;16,0;32,3;;;196,0;0;0;0;1;2862;8801,0;2,07;Sonstiges;8,0;1
p0nc6syUBRM;Niederbayern: Brand in Baumarkt - Flammen schießen 30 Meter in die Höhe | #ntv #shorts #brand;07.05.2024 15:19;54;8572;22,0;41,52;26,0;0;22942;225;12;106;0,0;;3,5;1,0;13,2;1,8;21,2;2,1;19,5;3,1;20,1;3,0;11,5;;;5626,0;0;0;0;12;41093;17025,0;2,52;Bilder;6,5;1
g7BnF6w7INM;Gute Nachricht des Tages: Beim Spazieren ausgebüxt - Zweijähriger ist wohlauf | ntv  #ntv #shorts;05.02.2024 09:42;54;1149;22,0;41,53;3,0;1;3076;56;13;1;0,0;;4,4;0,6;8,7;1,6;10,0;2,5;7,7;5,9;16,9;13,7;27,8;;;404,0;0;0;0;13;6029;9620,0;1,65;Sonstiges;6,5;2
sBaR2tTz_PM;Großbritannien: Milkshake-Attacke auf Rechtspopulist Nigel Farage | #ntv #shorts;05.06.2024 11:51;52;1353;21,0;41,82;0,0;0;3735;40;10;8;0,0;0,7;3,0;1,1;10,3;1,1;16,0;1,9;15,1;2,8;19,0;9,5;19,5;;;259,0;0;0;0;10;5930;10087,0;3,23;Sonstiges;7,5;1
ABG7k6WaJhw;Denver: Erneute Panne bei Boeing-Flug | #ntv #shorts #boeing #flugzeug #panne;08.04.2024 12:21;45;1437;18,0;41,89;1,0;0;4577;44;1;13;0,0;;5,5;0,6;13,7;0,7;16,4;1,3;15,8;2,5;20,1;4,8;18,6;;;646,0;0;0;0;1;9086;8164,0;2,23;Sonstiges;8,5;1
aartO9oWFHM;USA: US-Präsident Biden verschärft Asyl-Regeln im Alleingang | #ntv #shorts #biden #asylum;05.06.2024 10:26;60;1303;25,0;41,95;3,0;0;3106;41;9;8;0,0;;6,6;0,8;15,1;1,4;14,6;2,7;11,2;3,9;15,0;8,2;20,5;;;245,0;0;0;0;9;6588;13140,0;2,31;Politik;8,5;2
M3hrJdh4TDY;Ukraine: Erneut russische Angriffe auf Charkiw - mindestens drei Tote | #ntv #shorts #ukraine;31.05.2024 13:51;60;1643;25,0;41,95;0,0;0;3917;30;6;0;0,0;0,1;2,2;0,4;3,6;0,5;6,4;1,1;10,1;4,2;21,7;10,7;39,0;;;484,0;0;0;0;6;6377;14163,0;1,97;Krieg;8,5;1
fhabbVheVGE;London: E-Bus steht in Flammen | #ntv #shorts;12.01.2024 18:00;43;1472;18,0;42,46;5,0;1;4839;68;3;43;0,0;1,1;2,8;1,7;10,2;2,2;15,5;3,1;14,9;5,5;18,0;7,9;17,0;;;1312,0;0;0;0;3;9877;16404,0;2,23;Bilder;6,5;1
6eWhkLw_A58;Vulkanausbruch auf Hawaii: Kilometerlanger Riss spuckt Lava | #ntv #shorts #vulkan #lava;04.06.2024 16:23;55;437;23,0;0,0;3,0;0;1122;22;3;5;0,0;;9,1;;11,7;;14,3;;14,9;;12,3;14,3;23,4;;;136,0;0;0;0;3;4201;8613,0;1,78;Bilder;7,5;1
Hcam0A2xhAA;Taiwan: Armee demonstriert Abwehrbereitschaft gegen China | #ntv #shorts #taiwan;22.07.2024 12:42;58;1747;24,0;42,58;0,0;0;4246;45;6;5;3,0;;3,6;;13,0;;15,9;;17,7;1,0;23,6;1,8;23,4;;;180,0;0;0;0;6;6846;13262,0;3,74;Krieg;8,5;1
7PU1EilLhrE;Tschechien: Zugunglück mit mehreren Toten und Verletzten | #ntv #shorts #zug #czech;06.06.2024 10:09;60;1439;25,0;42,61;4,0;0;3379;43;8;17;0,0;;2,6;;5,6;1,0;7,4;1,5;12,3;7,0;21,4;14,0;27,2;;;435,0;0;0;0;8;7620;16690,0;1,89;Sonstiges;8,5;1
YFX9njJ9oTg;Mannheim: Machete in Bibliothek gebracht - Polizei erschießt Mann | #ntv;24.04.2024 10:26;60;13727;25,0;42,68;18,0;1;32160;621;43;178;0,0;0,9;5,7;2,7;14,6;3,7;17,5;4,2;13,5;6,2;14,8;6,3;9,9;;;3802,0;0;0;0;43;59807;23435,0;4,71;Sonstiges;8,5;1
nKeZxijmtj4;Frachter rammt Brücke - Fahrbahn und Autos stürzen ab | #ntv #shorts #nachrichten #china;22.02.2024 11:35;55;69875;23,0;42,71;18,0;0;178461;109;23;39;0,0;0,1;0,6;0,5;2,4;1,8;7,5;3,0;11,4;7,1;23,6;11,6;30,4;;;28536,0;0;0;0;23;26800;16550,0;3,27;Sonstiges;6,5;1
06Daw5Wneps;Die neue Folge ntv Faktenzeichen gibts hier auf Youtube und auf ntv.de | #ntv #faktencheck;05.03.2024 16:27;56;327;23,0;42,73;2,0;0;821;12;8;3;0,0;;15,3;;19,2;;15,3;;16,4;;15,8;;18,1;;;150,0;0;0;0;8;2679;5948,0;1,38;Sonstiges;5,5;1
rnzg-O2UXb8;Wahlkampf mit Flammenwerfer: US-Republikanerin verbrennt LGBTQ-Bücher | #ntv #shorts #usa;09.02.2024 14:11;60;1784;25,0;42,78;0,0;0;4172;95;22;33;0,0;;2,2;0,5;7,5;0,6;12,5;0,7;15,2;4,4;21,3;9,2;26,0;;;211,0;0;0;0;22;6902;27026,0;3,68;Sonstiges;6,5;2
C0zBcIUCcqw;Was tun, wenn das Haustier weg ist? | ntv Service;22.09.2024 13:00;59;288;25,0;42,84;0,0;0;684;23;2;0;1,0;;;;14,8;6,1;10,7;;15,3;5,1;8,2;15,8;24,0;;;61,0;0;0;0;2;2107;16809,0;9,2;Sonstiges;6,5;1
RSXSW9q-SMk;"""""""Odysseus"""" gelingt erste US-Mondlandung seit 50 Jahren | #ntv #shorts #nachrichten #usa #odysseus""";23.02.2024 10:59;59;789;25,0;42,96;1,0;0;1868;35;9;7;0,0;;;;8,9;;12,0;;9,0;1,8;20,1;9,5;38,6;;;84,0;0;0;0;9;4684;8540,0;2,92;Sonstiges;7,5;1
oAtxeCFsYGo;Achtung Tiefflug! Hubschrauber fliegt zur Übung durch den Eiffelturm | #ntv #shorts #paris #olympics;04.06.2024 17:14;43;1842;18,0;42,97;2,0;2;5982;60;9;13;0,0;;7,2;;14,7;0,3;14,2;0,9;12,4;2,7;19,4;5,7;21,7;;7,0;328,0;0;0;0;9;10864;10933,0;3,38;Sonstiges;6,5;1
Eo5EbFB8Cp8;China: Staubteufel entsteht aus dem Nichts | #ntv #shorts #sturm;23.04.2024 17:50;60;1320;25,0;43,0;2,0;0;3071;51;4;7;0,0;1,0;6,8;1,3;15,5;1,0;18,1;1,7;12,3;4,5;15,8;7,6;14,5;;;522,0;0;0;0;4;7177;10075,0;3,53;Sonstiges;6,5;1
jEnjfsriHs0;Steilküste bricht ab: Luxus-Villen stehen am Abgrund | ntv;14.02.2024 13:54;57;355343;24,0;43,07;36,0;2;868456;80;5;175;0,0;0,2;0,4;1,3;1,8;4,6;5,5;7,5;8,1;14,7;15,2;20,1;20,5;;;427995,0;0;0;0;5;0;71213,0;5,78;Sonstiges;6,5;3
zsEdv6TPs-0;Albanien: Waldbrände lodern direkt neben Hotels am Mittelmeer | #ntv #shorts #albania;31.07.2024 11:30;60;440;25,0;43,08;0,0;0;1022;21;0;13;2,0;;;1,1;8,2;;8,2;1,8;8,1;7,8;16,4;20,9;27,6;;;176,0;0;0;0;2;5562;10586,0;2,61;Sonstiges;6,5;1
cSdoH2yEIWI;Blitzender Tornado fegt über Florida | #ntv #shorts #florida #tornado;08.01.2024 17:00;60;636;25,0;43,18;0,0;0;1474;26;1;7;2,0;;4,3;;7,9;;14,0;2,0;10,1;9,1;16,6;15,0;21,1;;;343,0;0;0;0;1;3788;11214,0;1,51;Bilder;8,5;1
w5CgOHRg7Zw;Herausgebrochenes Flugzeugteil in Portland gefunden | #ntv #shorts #boeing;08.01.2024 11:38;53;2344;22,0;43,23;2,0;0;6140;51;12;17;1,0;0,5;11,3;0,6;10,9;0,7;8,6;1,1;11,1;2,6;19,8;5,7;26,5;;6,0;1622,0;0;0;0;12;15149;8866,0;1,65;Sonstiges;8,5;2
kFm2nxVK2go;Angriff nahe der Krim: Ukraine will russisches Landungsboot versenkt haben | #ntv #shorts #ukraine;14.02.2024 12:39;59;3908;25,0;43,26;4,0;0;9188;119;43;3;0,0;;0,6;;2,6;0,2;8,1;1,1;12,7;3,8;26,5;9,9;34,4;;;116,0;0;0;0;43;16784;17031,0;2,84;Krieg;6,5;2
t7YDdYHaTUQ;Malmö: Proteste wegen Israels ESC-Teilnahme - Greta Thunberg auch dabei #ntv #shorts #esc #palestine;10.05.2024 11:52;60;6182;26,0;43,34;12,0;0;14265;605;123;92;0,0;0,6;2,4;2,1;10,0;3,1;13,5;4,9;13,9;7,6;16,4;10,5;15,1;;;3621,0;0;0;0;123;27667;39228,0;5,19;Sonstiges;6,5;2
5ubFjySRViU;"""Spanien: Umstrittenes Pferderitual """"Las Luminarias"""" | #ntv #shorts #spanien""";17.01.2024 13:30;45;311;19,0;43,35;0,0;0;957;9;11;2;0,0;;;;9,6;;18,0;;;8,8;14,9;12,7;36,0;;;94,0;0;0;0;11;2065;7413,0;1,56;Sonstiges;6,5;1
nCBjFpKoX1k;Explosiver Crash in Ohio: Tanklaster geht in Flammen auf | #ntv #shorts #ohio;29.01.2024 16:56;53;727;23,0;43,43;0,0;0;1897;13;3;2;0,0;;6,8;;7,8;;15,3;1,1;17,1;5,6;21,8;5,1;19,6;;;300,0;0;0;0;3;3465;7372,0;3,2;Bilder;7,5;1
k8s5smqZQwg;Polizei-Lockvögel tricksen Uhren-Diebe aus in London | ntv #shorts;18.01.2024 16:01;53;7328;23,0;43,63;16,0;1;19015;160;16;24;0,0;0,4;1,6;1,1;7,4;2,7;13,6;3,6;15,9;6,5;20,6;8,5;18,2;;;2360,0;0;0;0;16;41507;12405,0;2,31;Sonstiges;7,5;2
VF5x2ypoveI;Pasta 3.0  Roboter-Köche von Startups revolutionieren die Gastronomie | #ntv #shorts #robot;21.09.2024 12:00;56;2089;24,0;43,72;0,0;0;5120;44;8;17;12,0;1,3;12,2;2,1;20,1;1,9;10,5;2,7;6,6;6,8;11,2;10,0;14,6;;;720,0;0;0;0;8;4476;19503,0;1,2;Wirtschaft;6,5;2
sSeyIk6em34;"""Der """"Trauer Safe Space"""" hilft Angehörigen bei Todesfällen | #ntv""";13.10.2024 12:00;60;746;26,0;43,74;0,0;0;1706;33;3;1;3,0;;5,1;;8,8;2,3;12,0;2,8;11,1;7,8;15,1;11,7;23,4;;;32,0;0;0;0;3;2484;23642,0;2,76;Sonstiges;6,5;1
78FyR5l0MLw;Syrien: Mehrere Kinder sterben bei Schulbusunfall | #ntv #shorts #syria;07.06.2024 12:08;44;672;19,0;43,79;1,0;0;2093;18;2;4;0,0;;;;6,7;;8,1;1,5;8,9;4,9;21,6;16,9;31,5;;;41,0;0;0;0;2;4626;14246,0;1,9;Sonstiges;7,5;1
uyU-To7LDxQ;"""Hamburger Dom: Besucher in """"Höllenblitz"""" Geisterbahn gefangen | #ntv #shorts""";16.04.2024 15:36;53;343;23,0;44,01;0,0;0;883;9;1;2;0,0;;;;;;;;;;;;;;;164,0;0;0;0;1;2429;7228,0;2,12;Sonstiges;6,5;1
eFIG9JQbwQM;Flugzeugabsturz in Thailand: Deutscher Passagier überlebt schwer verletzt | #ntv #shorts #thailand;16.01.2024 15:52;57;886;25,0;44,08;0,0;0;2117;12;1;6;0,0;;4,3;;10,6;1,3;10,3;1,6;7,4;9,2;16,4;14,0;24,8;;;541,0;0;0;0;1;3731;8776,0;2,53;Sonstiges;8,5;1
mPgJaWHD4f4;Rekord aufgestellt: Britin wagt zum 102. Geburtstag Fallschirmsprung | #ntv #shorts #skydiving;27.08.2024 14:49;60;1331;26,0;44,13;3,0;0;3016;150;5;16;6,0;3,9;19,2;1,8;20,6;2,7;15,0;1,6;8,5;1,1;9,7;2,4;8,2;15,0;39,0;582,0;0;0;0;5;7525;9416,0;1,73;Sonstiges;6,5;2
tE4AJ9LVWtQ;"""""""Wir stehen zu Europa"""" - CSU-General Huber im Frühstart | ntv #shorts""";11.03.2024 11:08;60;878;26,0;44,33;1,0;0;1981;32;12;3;3,0;;;;9,4;;11,8;;8,5;4,3;20,0;12,5;33,6;;;186,0;0;0;0;12;3735;9530,0;1,39;Politik;7,5;2
aUbuY1RpsbQ;Nach Frachter-Unglück in Baltimore: US-Armee sprengt sprengt Brücke | #ntv #shorts;14.05.2024 16:07;57;670;25,0;44,34;0,0;0;1591;13;2;1;0,0;;;;9,8;;14,7;;14,5;3,5;24,0;8,8;24,8;;;110,0;0;0;0;2;3450;10433,0;2,64;Sonstiges;6,5;1
xvK-cEFCf1g;Connecticut: Tanklaster geht nach Unfall in Flammen auf | #ntv #shorts;03.05.2024 11:37;58;2974;25,0;0,0;7,0;0;6930;97;8;17;0,0;1,0;5,1;1,0;9,6;1,5;14,1;1,8;13,1;5,9;17,4;7,9;20,5;;11,0;705,0;0;0;0;8;11112;18277,0;3,28;Sonstiges;6,5;1
JipkON_9eUQ;Spektakuläre Aufnahmen: Nordlichter tanzen über Island-Vulkan | #ntv #shorts #vulkan #northernlights;18.04.2024 12:15;58;715;25,0;44,43;2,0;0;1666;34;0;33;3,0;;;;6,3;0,0;9,7;;5,6;;22,3;22,8;33,2;;;265,0;0;0;0;0;3155;8810,0;2,55;Bilder;8,5;1
3NEukrYG5AE;Kanntet ihr das gefälschte Bild am Ende? Die ganze Folge ntv #Faktenzeichen findet ihr hier verlinkt;04.06.2024 16:21;60;773;26,0;44,43;2,0;0;1740;31;7;4;8,0;;5,7;;10,4;;13,8;3,6;10,2;2,2;21,2;11,9;20,9;;;86,0;0;0;0;7;3967;9759,0;3,32;Sonstiges;5,5;1
6biPXDEzt5c;Istanbul: Feuer bricht in historischem Markt aus | #ntv #shorts #istanbul;15.05.2024 13:48;53;724;23,0;44,58;1,0;0;1839;17;3;11;1,0;;4,2;;10,5;;16,7;;9,5;2,9;15,3;15,4;25,6;;;71,0;0;0;0;3;2923;6270,0;2,85;Sonstiges;7,5;1
oF0HjL9-lW4;Berlin: Brand am Alexanderplatz - Bahnverkehr zeitweise eingestellt | #ntv #shorts #berlin #alex;13.05.2024 11:41;59;1063;26,0;0,0;2,0;0;2415;36;8;20;0,0;;4,0;;10,1;;12,2;;10,7;5,3;19,9;13,5;24,3;;;202,0;0;0;0;8;4517;18176,0;3,76;Sonstiges;6,5;1
jsa4K2EHkec;"""Bald sticht sie in See: """"Icon of the Seas"""" ist das größte Kreuzfahrtschiff der Welt | #ntv #shorts""";12.01.2024 17:00;56;858;25,0;44,84;0,0;0;2052;21;12;8;0,0;;4,5;;9,7;;9,3;1,6;9,9;3,5;22,2;6,7;32,6;;;375,0;0;0;0;12;6155;11142,0;1,72;Sonstiges;8,5;1
mBxswD7lWgk;Polizei nimmt bei Großrazzia Luxus-Schleuser hoch | #ntv #shorts #razzia #polizei;17.04.2024 10:52;58;4072;26,0;44,86;4,0;0;9392;188;9;36;17,0;0,3;2,9;0,5;9,3;1,2;13,7;1,6;11,4;4,9;17,0;13,9;23,3;;;693,0;0;0;0;9;14929;22160,0;4,37;Sonstiges;6,5;1
YOMHdQZfiEM;Mexiko: Feuerspucker geht mit Feuer auf Mariachi los | #ntv #shorts #mexico;22.05.2024 10:02;60;1706;26,0;44,87;1,0;0;3804;26;6;13;0,0;0,7;5,4;1,3;15,5;1,8;19,4;0,9;15,6;3,0;17,1;4,8;14,6;;;429,0;0;0;0;6;5500;7142,0;4,05;Sonstiges;6,5;1
KTLfHVovoy0;In letzter Sekunde: Helfer retten Mann aus brennendem Unfallauto | #ntv #shorts #usa #unfall #feuer;22.04.2024 12:23;60;4448;26,0;44,96;3,0;1;9894;166;5;25;0,0;0,3;2,0;0,5;6,9;1,5;13,0;1,8;15,3;4,3;24,4;7,8;22,2;;;841,0;0;0;0;5;17625;11815,0;4,06;Sonstiges;6,5;1
XNk1EoqkQKo;Digitales Bezahlen: Stirbt das Bargeld bald aus? | ntv;13.11.2024 17:45;59;1049;26,0;44,98;1,0;0;2372;17;18;2;16,0;;;;9,8;0,9;16,3;;11,7;2,2;19,6;12,1;27,4;;;142,0;0;0;0;18;4908;19149,0;1,91;Wirtschaft;6,5;2
9iUDCWYXhpw;Berlin: Pro-Palästina Proteste - Polizei räumt Gelände der FU Berlin #ntv #shorts #berlin #palestine;07.05.2024 17:56;60;5369;27,0;45,17;6,0;0;11887;287;32;51;0,0;0,5;3,7;1,2;13,2;2,0;17,8;1,8;16,3;4,3;18,5;6,7;14,0;;;1249,0;0;0;0;32;18929;30041,0;4,02;Sonstiges;7,5;1
R-Ms01FJrv4;USA: Industrielager in Michigan geht in Flammen auf | #ntv #shorts #nachrichten #michigan #feuer;05.03.2024 17:45;59;1039;26,0;45,38;1,0;1;2329;24;3;10;0,0;;3,0;;4,1;;8,5;;10,8;6,3;21,4;13,5;32,4;;;44,0;0;0;0;3;3996;11719,0;2,17;Bilder;8,5;1
CB4XYvqDa-8;90-jährige Marathonläuferin hat noch lange nicht genug | #ntv #shorts #marathon #maschine;20.09.2024 12:11;60;2044;27,0;45,55;2,0;0;4488;104;9;47;5,0;2,4;5,4;3,6;11,0;4,7;9,7;4,4;9,9;5,7;12,8;9,1;18,2;15,0;16,0;775,0;0;0;0;9;8811;17045,0;2,15;Sonstiges;6,5;2
tHjNxmsH_ZQ;Explosion in Feuerwerksfabrik tötet mehrere Menschen | #ntv #shorts;07.02.2024 15:50;56;1261;25,0;45,57;3,0;0;2966;30;2;5;0,0;1,3;6,9;1,5;8,4;2,0;9,7;1,3;8,5;3,8;18,2;8,7;29,7;;;575,0;0;0;0;2;5202;8446,0;1,69;Bilder;6,5;2
NJ4dpulQLhQ;Peru: Lastwagendieb liefert sich dramatische Verfolgungsjagd mit Polizei | #ntv #shorts #peru;15.05.2024 12:29;57;3330;26,0;45,85;5,0;0;7646;79;2;5;0,0;0,8;7,8;1,1;15,2;1,4;19,3;1,5;17,2;2,1;17,6;2,3;13,1;;5,0;2325,0;0;0;0;2;12336;8334,0;2,71;Sonstiges;8,5;1
G_assN676Ws;Irak: Feuer zerstört einen der größten Basare in Erbil | #ntv #shorts #nachrichten #irak #feuer;28.02.2024 13:02;60;628;27,0;45,91;1,0;0;1369;17;0;7;0,0;;;;3,4;;6,9;;9,0;4,8;23,6;12,0;40,4;;;56,0;0;0;0;0;2293;10057,0;2,56;Sonstiges;7,5;1
iwHnbkaFh84;London: Qualmendes Flugzeug-Triebwerk sorgt für Aufregung am Flughafen Heathrow | #ntv #shorts;19.03.2024 14:25;57;4744;26,0;45,91;9,0;0;10877;112;20;36;0,0;0,2;2,5;0,3;4,9;0,8;8,7;1,3;13,6;3,7;25,5;7,4;30,8;;3,0;916,0;0;0;0;20;15331;10873,0;4,29;Sonstiges;7,5;1
zZjC5qqLUbI;Mehrere Tote nach Busunglück in Afghanistan | #ntv #shorts #nachrichten #afghanistan #unfall #bus;18.03.2024 12:34;44;878;20,0;46,07;2,0;0;2599;22;6;7;4,0;;2,7;;5,3;;10,1;2,3;10,7;5,6;21,9;13,5;27,8;;;398,0;0;0;0;6;5111;7403,0;1,7;Sonstiges;8,5;1
7Cg7e8pMK2c;"""""""KI soll diskriminierungsfrei sein"""" - F. Brantner, Staatssekretärin des Wirtschaftsministeriums #ntv""";02.02.2024 14:32;56;886;25,0;46,09;1,0;0;2061;21;13;6;0,0;;4,5;1,4;7,6;1,6;13,1;;10,3;2,8;21,6;11,9;25,3;;;341,0;0;0;0;13;3931;19854,0;1,36;Wirtschaft;6,5;2
33LUj4ZpBPE;Farbattacke auf Schloss Versailles: Aktivisten verstreuen orangenes Pulver #ntv #shorts #versailles;07.05.2024 16:14;44;421;20,0;46,11;0,0;0;1245;10;6;2;0,0;;;2,2;15,5;2,2;19,3;3,0;12,9;4,8;15,5;10,8;13,7;;;145,0;0;0;0;6;1984;5108,0;1,51;Sonstiges;6,5;1
JpSF_lSkCnA;Arizona: Betäubung von Puma geht beinahe schief | #ntv #shorts #puma #arizona;13.02.2024 17:01;52;932;24,0;46,22;1,0;0;2327;20;2;2;0,0;;5,8;1,1;11,8;2,0;22,0;1,5;19,9;4,0;18,4;2,7;10,8;;;345,0;0;0;0;2;3921;7551,0;1,81;Sonstiges;8,5;1
lD3DTR0cpBw;Mexiko: Riesige Bühne kracht bei Wahlkampfveranstaltung ein - mehrere Tote | #ntv #shorts #mexico;23.05.2024 10:04;55;641;25,0;46,23;2,0;0;1513;15;2;3;0,0;;9,2;1,5;19,5;1,4;16,8;1,5;12,3;4,6;13,6;7,0;12,6;;;210,0;0;0;0;2;2448;6166,0;2,87;Sonstiges;8,5;1
6K5bp1mCotM;Brasilien: Flugzeug schießt über Landebahn hinaus | #ntv #shorts #flugzeug;26.04.2024 14:12;53;1949;24,0;46,34;0,0;0;4762;40;3;10;1,0;;2,4;0,7;7,7;1,5;10,8;1,8;11,5;4,0;21,7;8,5;29,4;;;166,0;0;0;0;3;8378;11996,0;3,38;Sonstiges;6,5;1
8VezwzZOagA;Triebwerk fällt aus - Pilot meistert Landung auf Straße | #ntv #shorts #flugzeug;23.04.2024 16:44;45;2252;20,0;46,34;0,0;0;6482;69;5;10;0,0;0,3;3,1;;6,8;0,8;11,0;1,8;12,5;5,0;21,8;9,9;27,0;;;927,0;0;0;0;5;11604;9242,0;4,31;Bilder;6,5;1
