video_id;title;publish_date;video_length_seconds;wiedergabezeit_minuten;durchschnittliche_wiedergabedauer;durchschnittliche_wiedergabedauer_prozent;gewonnene_abonnenten;verlorene_abonnenten;aufrufe;likes;dislikes;geteilte_inhalte;kommentare;audience_female_age18-24;audience_male_age18-24;audience_female_age25-34;audience_male_age25-34;audience_female_age35-44;audience_male_age35-44;audience_female_age45-54;audience_male_age45-54;audience_female_age55-64;audience_male_age55-64;audience_female_age65-;audience_male_age65-;audience_female_age13-17;audience_male_age13-17;Neue Zuschauer;Klicks auf Abspannelement;Klicks auf Infokartenteaser;Klicks auf Infokarte;Mag ich nicht-Bewertungen;Im Feed angezeigt;Impressionen;Klickrate der Impressionen (%);Thema;Bewertung_Titel;Gestaltung_Thumbnail
bBqI2vG_lAI;Nawalnys Frau als neue Oppositionsanführerin? Dann wird der Kreml reagieren - ntv-Reporter Leontjew;20.02.2024 17:47;45;6911;32,0;72,67;9,0;0;12682;180;49;18;0,0;;0,9;0,2;4,0;0,5;8,3;1,3;12,9;5,0;25,0;10,2;31,8;;;1201,0;0;0;0;49;20420;26450,0;2,53;Politik;8,0;2
xTfinibVETE;Israels Armee zerstört 2,5 Kilometer langen Hamastunnel | #ntv #shorts #nachrichten #hamas #israel;18.03.2024 13:11;42;9486;30,0;72,68;10,0;1;18646;281;57;18;37,0;;3,2;0,4;8,3;0,7;12,7;1,0;14,0;3,0;21,0;6,4;29,4;;;1097,0;0;0;0;57;32613;28078,0;4,13;Krieg;8,0;1
HudT54zOlE8;Woher bekommt Putin seine Soldaten? | #ntv #shorts #nachrichten #putin #russland;17.09.2024 16:35;59;116060;42,0;72,71;94,0;5;162332;2184;253;317;174,0;0,1;1,4;0,4;6,0;1,0;12,0;1,5;14,4;3,4;23,1;7,3;29,2;;;4214,0;0;0;0;253;218405;496954,0;5,08;Krieg;6,5;2
lfBHdv8yHec;Russische Militärbasis angegriffen: Große Rauchsäule steigt über Kursk auf | #ntv #shorts #russland;04.07.2024 10:11;45;47775;32,0;72,79;62,0;1;87511;1344;231;141;106,0;0,1;1,0;0,3;4,0;0,7;8,4;1,3;11,9;3,9;25,0;8,5;35,0;;;2848,0;0;0;0;231;119508;316651,0;5,83;Krieg;8,5;1
UNfvEdns19Q;Was verbinden Sie mit dem D-Day, Herr Djir-Sarai? | #ntv;18.11.2024 14:13;59;6891;42,0;72,86;5,0;1;9619;113;22;100;42,0;;2,0;0,6;9,0;0,7;10,2;1,6;9,1;4,5;19,7;13,0;29,5;;;1789,0;0;0;0;22;10198;35250,0;5,0;Politik;6,5;2
h_fxNlGDtto;Auf Ausschreitungen vorbereitet: Alles abgesperrt rund ums Weiße Haus in Washington | #ntv;04.11.2024 10:24;39;894;28,0;0,0;0,0;0;1888;31;6;11;1,0;;5,7;;14,3;1,6;15,0;2,4;8,2;5,1;15,5;11,0;21,3;;;141,0;0;0;0;6;2652;13064,0;3,27;Politik;7,5;1
wc4sKL6qNkA;2800-Meter-Brücke in Baltimore bricht ein | ntv #shorts;26.03.2024 14:46;45;3565;32,0;72,92;4,0;0;6520;83;8;52;12,0;0,3;3,8;1,1;10,9;2,2;12,0;2,3;11,1;5,2;22,6;6,3;22,2;;;714,0;0;0;0;8;12930;17951,0;4,87;Sonstiges;6,5;1
_JgW_0g4sqo;Wegen SA-Parole: Thüringens AfD-Chef Björn Höcke steht heute vor Gericht. Was droht ihm nun? #ntv;18.04.2024 11:15;42;3206;30,0;73,09;1,0;0;6268;78;87;11;74,0;0,0;0,6;;5,5;0,7;7,7;0,8;11,7;4,3;26,1;11,0;31,6;;;509,0;0;0;0;87;11171;17915,0;2,6;Politik;6,5;3
VHHEutajcDY;Ulrich Lechte, außenpolitischer Sprecher der FDP-Bundestagsfraktion im #ntv Frühstart;24.07.2024 12:45;28;1047;20,0;73,13;0,0;0;3068;40;25;1;19,0;0,9;4,5;1,8;9,0;0,7;10,8;1,2;8,6;4,7;19,0;12,3;26,5;;;186,0;0;0;0;25;4446;12167,0;1,08;Politik;6,5;2
RNf2W5sq_SM;Straßenumfrage: Wie findet ihr die Cannabis-Legalisierung? | #ntv #shorts #cannabis #legalisierung;22.02.2024 13:30;42;7505;30,0;73,22;3,0;0;14643;317;50;24;0,0;0,7;18,0;1,1;27,9;0,9;16,9;1,0;8,5;2,1;9,1;3,6;10,0;;3,0;3228,0;0;0;0;50;22792;22930,0;5,55;Sonstiges;7,5;1
ofQ2RLn12S0;"""""""Dieses ukrainische Land hat Russland ja schon annektiert"""" - Rainer Munz aus Moskau | #ntv""";26.11.2024 17:55;55;14939;40,0;73,27;10,0;0;22245;338;46;36;30,0;;0,2;0,2;1,7;0,5;4,3;1,5;7,6;4,9;20,7;15,9;42,5;;;210,0;0;0;0;46;27394;159108,0;6,99;Krieg;6,5;2
ADHvSML1408;Zwei große Explosionen - Huthis zeigen Drohnenboot-Angriff auf Frachter. #ntv #nachrichten #shorts;21.06.2024 09:56;54;30583;39,0;73,29;19,0;0;46363;501;104;143;68,0;0,1;1,1;0,3;4,5;0,8;9,2;1,5;12,7;4,4;24,5;8,8;32,2;;;591,0;0;0;0;104;60338;42993,0;5,31;Krieg;8,0;1
_ldShZ4ZbMk;Da kommt ein ganzer Regenbogen aus dem Hintern.. | #ntv;14.10.2024 12:01;31;146201;22,0;73,41;206,0;9;385445;6945;255;2058;70,0;5,2;7,9;5,5;16,8;6,9;19,4;4,2;11,3;3,2;7,9;2,3;4,0;34,0;21,0;106119,0;0;0;0;255;513951;29850,0;2,56;Politik;6,5;1
tNteTeKKN0s;Kerpen: Güterzug entgleist - drei Verletzte | #ntv;22.11.2024 11:19;34;1201;24,0;73,47;6,0;0;2887;40;4;34;3,0;;3,3;0,9;11,4;0,8;11,6;1,2;12,8;2,8;19,3;7,2;28,8;;;447,0;0;0;0;4;4210;52115,0;2,12;Sonstiges;6,5;1
WJv1ShT1xMQ;Auch die USA müssen sich an die Nato-Zusagen halten - Philipp Amthor (CDU) im Frühstart | #ntv;14.02.2024 10:30;39;20256;28,0;73,54;24,0;0;42375;559;284;93;0,0;0,1;1,2;0,5;5,3;1,1;9,2;2,2;11,7;6,2;22,8;11,7;28,0;;;3422,0;0;0;0;284;67766;38529,0;4,34;Politik;6,5;2
qE2XRea9fjo;Nach Ampel-Aus: Wirtschaftsvertreter wünschen sich Stabilität | ntv;12.11.2024 14:59;60;3665;44,0;73,62;2,0;0;4979;68;17;10;17,0;;0,7;0,4;2,3;0,7;5,4;1,6;8,0;7,4;19,1;20,5;34,0;;;33,0;0;0;0;17;6797;19176,0;4,24;Wirtschaft;6,5;2
VqTIZGti-fI;Mann entführt Bus in Los Angeles und nimmt Geiseln | #ntv #nachrichten #geiselnahme #usa;26.09.2024 14:24;38;1666;27,0;73,63;0,0;0;3574;75;10;17;7,0;0,6;7,7;1,0;13,8;2,0;14,5;1,6;11,4;3,7;17,7;7,5;18,7;;;228,0;0;0;0;10;5638;29408,0;2,43;Sonstiges;8,5;1
ix4MiVDQPvE;Extremkälte in Chicago: Lake Michigan zugefroren | #ntv #shorts #lakemichigan;16.01.2024 14:39;60;2016;44,0;73,66;3,0;1;2738;42;8;22;0,0;;;;6,4;1,4;16,1;1,6;14,8;5,0;20,7;9,7;24,3;;;215,0;0;0;0;8;2170;17709,0;4,2;Sonstiges;8,5;1
KVWwxdWsLWw;Israelis mit Steinschleudern und Pfeile - Mittelalterliche Waffen gegen Hisbolla | #ntv #shorts;14.06.2024 11:40;43;7275;31,0;73,68;9,0;0;13779;163;63;98;0,0;0,5;3,5;0,9;11,7;1,1;15,3;2,0;13,7;3,5;18,6;6,9;22,2;;;651,0;0;0;0;63;19016;15654,0;2,44;Krieg;6,5;1
VmfPVqwBBbU;Bayern: Halle mit Luxusautos brennt nach Blitzeinschlag | #ntv #shorts #bayern #oldtimer;02.08.2024 09:46;47;6497;34,0;0,0;4,0;0;11255;151;13;96;19,0;;0,9;0,3;3,0;0,6;6,5;1,9;8,3;7,0;17,7;19,1;34,6;;;390,0;0;0;0;13;14660;40101,0;3,25;Sonstiges;6,5;1
1ENSUx8bXN4;Warum wird in den USA immer dienstags gewählt? | #ntv;04.11.2024 12:23;53;1692;39,0;73,75;1,0;0;2598;41;4;12;3,0;;3,6;1,3;9,9;1,9;14,0;2,5;12,5;4,6;17,4;8,6;23,8;;;168,0;0;0;0;4;3436;48484,0;2,52;Politik;6,5;1
q8u8RmtGjLM;"""""""Die Schuldenbremse in Kriegszeiten ist eine Albernheit"""" - Hofreiter im Frühstart | ntv #shorts""";08.02.2024 10:57;53;6336;39,0;73,82;6,0;1;9718;164;347;98;0,0;;0,5;;3,3;0,3;8,5;1,2;12,3;4,4;27,0;9,7;32,7;;;825,0;0;0;0;347;13119;22228,0;3,72;Wirtschaft;6,5;2
FKj1MbwCWIM;Stabilität in der Regierung ist wichtig - Andreas Audretsch (Grüne) im #ntv Frühstart;04.07.2024 09:37;32;1753;23,0;73,83;1,0;0;4453;44;29;3;16,0;;0,9;0,4;2,5;;4,2;0,4;7,6;4,3;23,1;16,4;40,2;;;90,0;0;0;0;29;6352;13291,0;2,22;Politik;6,5;2
d4_c-PZA1sE;"""""""Das ist eine große Freiheit"""", Carsten Schneider, Ostbeauftragter | #ntv #shorts #deutschland""";02.10.2024 10:22;47;3981;34,0;0,0;2,0;1;6877;128;59;19;27,0;;1,5;0,3;5,5;0,8;5,9;1,3;7,9;5,5;19,5;18,7;33,1;;;121,0;0;0;0;59;10185;15225,0;1,54;Politik;6,5;2
fSjiHz8-DBc;Georg Maier (SPD) im #ntv Duell für die Landtagswahlen in Thüringen;29.08.2024 11:55;60;1450;44,0;73,94;0,0;0;1962;17;17;3;10,0;;;;4,6;;9,7;;12,4;3,0;25,6;9,7;35,1;;;44,0;0;0;0;17;2768;17480,0;3,1;Politik;7,5;2
syPAGFFZIEU;Politiker-Prügelei im Parlament der Malediven | ntv;01.02.2024 13:04;43;808;31,0;74,01;0,0;0;1524;18;4;24;0,0;;;;6,7;;8,0;;6,3;4,3;13,7;20,6;40,4;;;78,0;0;0;0;4;1900;11147,0;2,55;Sonstiges;6,5;1
VQYxoPdOmgY;Nordkorea demonstriert neue Hyperschall-Rakete | #ntv #shorts #nordkorea #rakete;03.04.2024 15:21;60;13321;44,0;74,02;17,0;1;17998;199;64;78;0,0;;2,5;;7,0;0,4;13,2;0,6;15,5;2,4;24,9;4,9;28,6;;;496,0;0;0;0;64;36941;26346,0;3,64;Sonstiges;8,5;1
L3vW9pIPS94;Migrationsdebatte wird nach Solingen-Attentat schärfer | #ntv #shorts #nachrichten #solingen;26.08.2024 11:06;59;2167;43,0;74,02;1,0;0;2978;38;21;4;37,0;1,2;4,4;1,3;12,7;1,8;8,1;1,9;11,6;7,1;14,1;15,0;20,7;;;244,0;0;0;0;21;3813;39958,0;3,41;Politik;8,5;2
bvXCmTLQpig;"""""""Arsch zusammenkneifen und jetzt regieren"""" - Roth (SPD) im #ntv Frühstart""";21.08.2024 11:30;59;12519;43,0;74,06;19,0;0;17191;290;217;62;200,0;0,1;1,8;0,6;4,0;1,1;5,3;1,7;7,9;6,2;18,7;18,2;34,6;;;141,0;0;0;0;217;22472;97926,0;5,07;Politik;6,5;2
BlOtsr7RjIU;Russland: Drohnenvideos sollen Putins luxuriösen Landsitz zeigen | #ntv #shorts #russland #putin;30.01.2024 16:53;60;16584;44,0;74,06;13,0;2;22393;185;88;100;0,0;0,1;2,1;0,5;7,3;1,0;14,0;1,6;15,7;3,5;23,2;6,1;24,9;;;2426,0;0;0;0;141;82235;23866,0;3,3;Krieg;8,5;1
ApnK8eYoHhI;Ukraine erwartet Hilfspaket aus den USA - Wolfgang Richter (Oberst a.D.) im #ntv #ukraine - Talk;22.04.2024 12:48;47;9074;34,0;74,09;7,0;0;15636;206;84;42;0,0;;0,5;0,3;2,4;0,3;6,4;1,3;10,5;4,0;23,8;11,8;38,7;;;253,0;0;0;0;84;24693;51594,0;3,8;Krieg;6,5;1
LAu9OGuSmn4;Den ntv Auslandsreport seht ihr freitags um 17.30 Uhr oder auf RTL+|  #ntv #shorts #auslandsreport;26.01.2024 17:00;28;967;20,0;0,0;0,0;0;2793;34;2;1;0,0;;5,0;0,9;11,6;;13,2;1,4;14,1;4,9;19,5;8,9;20,4;;;435,0;0;0;0;2;5967;18489,0;3,71;Sonstiges;6,5;1
LzxQSVKjzgk;"""""""Andere würden sogar das Wort 'Lüge' in den Mund nehmen"""", FDP-Fraktionschef Dürr im #ntv Frühstart""";12.11.2024 15:11;51;1133;37,0;74,22;0,0;0;1796;26;5;3;10,0;;;;9,5;;9,5;;11,1;3,9;18,1;17,1;30,7;;;72,0;0;0;0;5;3270;10290,0;3,18;Politik;6,5;2
g8DZ07TZB7s;Unwetter zieht über Deutschland | #ntv #shorts #unwetter #regen #gewitter;17.05.2024 12:27;52;14694;38,0;74,32;31,0;1;22812;396;39;242;15,0;0,2;0,6;1,4;3,8;2,8;6,9;4,5;8,3;11,2;16,8;20,1;23,3;;;2325,0;0;0;0;39;35153;66266,0;2,78;Sonstiges;6,5;1
8e058FSFbA8;Holy Crab! Hunderttausende Krabben in der Elbe #shorts #ntv #elbe #krabbe;28.02.2024 18:07;48;1367;35,0;0,0;1,0;1;2297;40;3;13;0,0;;;;7,3;;13,5;0,5;14,5;3,5;25,5;8,8;26,4;;;67,0;0;0;0;3;5165;10293,0;2,68;Sonstiges;6,5;1
5awM-2ruPYc;Damit enden hoffentlich die Spekulationen um ihren Gesundheitszustand #ntv #shorts;22.03.2024 20:27;31;16729;23,0;74,43;27,0;0;43504;726;61;139;84,0;0,6;0,6;3,7;2,2;9,0;5,2;11,5;7,1;17,6;11,6;18,1;12,8;;;8789,0;0;0;0;61;118121;28064,0;3,86;Politik;6,5;2
bNs5v7gJAOg;Bauteile russischer Drohen aus Europa und den USA? - Reisner im Ukraine-Talk | ntv;04.11.2024 17:10;56;16495;41,0;74,45;6,0;0;23740;396;29;34;39,0;;0,2;;7,9;0,4;15,5;0,7;17,0;3,2;23,0;6,1;26,0;;;216,0;0;0;0;29;31080;220705,0;5,36;Krieg;6,5;2
_z9UJ3PV54M;China: Mega-Sturm reißt Menschen aus Hochhäusern | #ntv #shorts #nachrichten #china #sturm;02.04.2024 16:03;60;31625;44,0;0,0;37,0;4;42453;412;67;282;0,0;0,3;1,6;1,0;5,6;2,0;9,9;3,2;11,4;7,7;19,7;13,1;24,4;;;5808,0;0;0;0;67;63912;171915,0;4,1;Sonstiges;8,5;1
H1rBrVwzE2A;Ölkatastrophe droht: Tanker mit Treibstoff sinkt in Bucht von Manila | #ntv #shorts #manila;25.07.2024 13:52;45;8146;33,0;74,52;11,0;0;14576;135;34;61;22,0;;0,3;0,5;2,4;0,7;6,6;1,8;9,2;7,2;21,6;14,7;35,1;;;295,0;0;0;0;34;17711;17551,0;3,89;Sonstiges;8,5;1
9rk7W-b0rxs;Trump plant Golfplatz - mitten im Naturschutzgebiet | #ntv #auslandsreport;30.11.2024 12:00;49;1859;36,0;0,0;0,0;0;3052;63;9;18;3,0;;1,1;;4,2;0,4;5,7;1,3;7,5;5,8;17,3;20,8;35,8;;;39,0;0;0;0;9;4928;38141,0;3,61;Sonstiges;6,5;1
uAZVQwl4Lf8;Peru: Bus mit Touristen stürzt 15 Meter in die Tiefe | #ntv #shorts #nachrichten #peru #machupicchu;17.09.2024 16:51;36;4521;26,0;74,76;2,0;0;10081;104;8;45;6,0;;0,8;0,3;2,7;1,5;6,5;3,0;9,6;7,6;20,4;16,9;30,7;;;212,0;0;0;0;8;15553;17713,0;2,72;Sonstiges;8,5;1
8R5u5HQDA8U;"""""""Ist nicht zu billigen"""" - Matthias Miersch, SPD-Klimapolitiker im #ntv Frühstart""";25.07.2024 10:27;50;9247;37,0;74,77;7,0;1;14841;467;30;37;45,0;;0,3;0,2;2,1;0,3;4,3;1,5;8,0;6,6;22,9;19,0;34,9;;;170,0;0;0;0;30;19007;72242,0;5,28;Politik;6,5;2
MkW7UdX1H1k;US-Präsident Biden stellt Selenskyj als Putin vor! Den ganzen Clip findet ihr hier verlinkt | #ntv;12.07.2024 10:12;51;15757;38,0;0,0;10,0;0;24783;301;66;231;78,0;0,1;1,5;0,6;4,6;1,0;7,8;1,8;9,1;5,7;18,6;16,4;32,8;;;489,0;0;0;0;66;52233;52639,0;5,1;Politik;6,5;2
SMPGNvkBGuM;Amokfahrt in China - was bisher bekannt ist | #ntv;13.11.2024 11:22;47;1225;35,0;74,82;1,0;0;2091;39;4;7;5,0;;;;10,3;2,3;13,5;3,0;10,9;5,5;14,6;14,3;25,4;;;90,0;0;0;0;4;3286;10784,0;4,28;Sonstiges;6,5;2
sr7tKDdq3YE;Rainer Munz, ntv Reporter aus Moskau | #ntv #shorts #nachichten #russland #ukraine #usa;16.09.2024 13:35;60;4524;45,0;75,04;3,0;0;6029;122;25;13;19,0;;0,7;;2,2;0,3;4,3;0,9;8,1;4,6;19,9;15,0;44,0;;;103,0;0;0;0;25;8699;55409,0;4,48;Krieg;6,5;2
eE2fpjL3b0Q;Schwein auf der Flucht | #ntv #shorts #usa #schwein;11.04.2024 10:10;28;2830;21,0;75,08;3,0;0;8078;157;8;29;4,0;0,6;2,9;1,3;7,2;3,0;13,1;2,7;14,2;5,8;19,8;8,9;20,4;;;1850,0;0;0;0;8;14357;4395,0;2,96;Sonstiges;6,5;1
UDCU6ocnv0o;Hat Russlands Rüstungsindustrie noch genügend Kapazitäten? | #ntv #shorts #ukraine #russland;06.05.2024 12:09;56;103129;42,0;0,0;70,0;2;146934;1767;229;192;242,0;0,0;1,1;0,2;6,2;0,4;13,6;0,7;17,5;1,6;27,2;3,3;28,2;;;7030,0;0;0;0;229;216427;328588,0;4,35;Krieg;6,5;2
2fSYmilPhDI;Das Kätzchen hatte richtig Glück. #ntv #nachrichten #shorts;21.06.2024 12:55;30;12505;22,0;75,24;19,0;1;33239;998;21;56;14,0;1,6;2,8;2,7;7,6;4,0;11,8;4,9;14,2;8,3;19,3;8,0;13,7;6,0;6,0;4167,0;0;0;0;21;54118;21343,0;2,31;Sonstiges;4,5;1
1-x0n8jFLTk;Politiker hat minutenlangen Lachanfall während Rede | #ntv #shorts #cdu #landtag #sachsenanhalt;13.06.2024 10:15;60;23783;45,0;75,32;9,0;0;31575;495;41;91;0,0;0,1;1,6;0,3;4,5;1,3;7,2;2,9;8,8;9,0;18,4;19,3;26,7;;;548,0;0;0;0;41;36282;232739,0;6,74;Sonstiges;6,5;1
SkxT0IP6jz0;"""""""Die Landwirtschaft ist auch Wirtschaft"""" - Carsten Linnemann, CDU Generalsekretär im Frühstart #ntv""";22.02.2024 10:18;51;4862;38,0;75,37;4,0;0;7590;254;35;39;0,0;;0,5;;2,6;0,6;6,5;1,5;11,1;6,7;24,6;14,3;31,7;;;411,0;0;0;0;35;14631;14807,0;2,84;Politik;6,5;2
eGluumglcr0;Mallorca: Starkregen flutet Ballermann und Palmas Flughafen | #ntv #shorts #mallorca;12.06.2024 12:10;60;11976;45,0;75,44;10,0;0;15875;179;16;231;0,0;0,1;0,9;0,7;4,7;1,0;5,8;2,3;6,3;12,3;18,6;20,9;26,5;;;1070,0;0;0;0;16;20563;75346,0;4,45;Sonstiges;7,5;1
O16epjQpbDE;"""""""Ernste Herausforderung für ostdeutsche Gesellschaft"""" - Klara Geywitz (SPD) im #ntv Frühstart""";11.06.2024 09:59;37;1263;27,0;75,59;1,0;0;2710;15;14;1;0,0;;;0,9;5,3;;11,8;;11,0;5,7;22,0;15,5;27,8;;;60,0;0;0;0;14;5307;19656,0;3,38;Politik;6,5;2
O9VT96m1pm8;Moskau: Putins Tochter gibt verstörendes Interview | #ntv #shorts #russland;12.01.2024 15:00;60;35759;45,0;75,95;42,0;3;47085;496;219;245;0,0;0,1;0,9;1,2;4,3;2,8;9,6;4,0;12,1;8,1;19,6;13,8;23,4;;;5362,0;0;0;0;223;76616;108615,0;6,19;Krieg;8,5;2
FB9KcemxAiw;Großer Brand in chinesischem Einkaufszentrum - 16 Tote | #ntv #shorts #china #brand;18.07.2024 12:09;42;9579;31,0;75,96;11,0;0;18015;228;32;46;20,0;0,1;0,6;0,3;2,7;1,1;5,6;2,3;8,3;7,1;20,4;16,0;35,6;;;176,0;0;0;0;32;23750;20027,0;3,03;Sonstiges;7,5;1
TBhcBGyFbtw;Trump droht mit Massenabschiebungen - Tausende Migranten dennoch auf Weg zur US-Grenze #ntv;24.11.2024 12:00;45;8240;34,0;75,97;6,0;0;14464;187;31;31;30,0;;1,2;0,4;3,7;1,1;6,0;2,0;8,0;7,4;19,1;17,0;34,1;;;232,0;0;0;0;31;20729;38371,0;3,92;Politik;8,5;1
GIkwstQYXAU;"""""""Traurige Stand der US-Politik"""" - Kleim zur Blockade der Ukraine-Hilfen | ntv #shorts""";08.02.2024 11:03;53;7965;40,0;76,04;9,0;3;11860;204;52;40;0,0;;2,0;0,2;4,4;0,3;7,7;1,1;10,7;4,2;22,7;11,4;35,3;;;573,0;0;0;0;52;18276;21882,0;2,92;Krieg;6,5;2
ObrkvoRDvAE;Winter in der Wüste: Erster Schneefall jemals in Saudi-Arabien | #ntv;08.11.2024 14:08;60;14457;45,0;76,05;12,0;0;19011;324;19;558;46,0;;1,7;0,9;5,3;1,9;8,4;3,1;9,1;8,0;18,9;14,9;27,9;;;3347,0;0;0;0;19;20994;74441,0;5,78;Sonstiges;8,5;1
snGLVPNE87s;"""""""Die Geduld ist bei allen am Ende"""" - Katarina Barley, EU-Spitzenkandidatin der SPD im Frühstart #ntv""";01.02.2024 11:11;38;5418;28,0;0,0;8,0;0;11242;169;158;53;0,0;0,4;1,5;0,6;2,4;0,5;4,5;1,0;8,9;6,3;22,8;14,9;36,2;;;777,0;0;0;0;158;17627;10606,0;4,3;Politik;6,5;2
n7JjG51ntRI;"""""""Trump hat jemanden gewählt, der tickt wie er"""" - Politikwissenschaftler Jäger zu Vize J.D. Vance""";16.07.2024 15:22;49;4791;37,0;76,12;8,0;0;7708;109;32;22;18,0;;0,6;;2,3;0,6;4,2;1,4;6,9;7,4;17,1;22,5;37,0;;;155,0;0;0;0;32;11054;44525,0;1,96;Politik;6,5;2
6d0x7CE9S3E;Er wünscht sich Ex-Kanzlerin Angela Merkel zurück -  Daniel Günther SH-Minister (CDU) im Frühstart;22.05.2024 11:32;26;719;19,0;76,14;2,0;0;2182;15;26;3;8,0;;;;2,5;;3,6;;5,8;2,5;17,9;21,8;46,0;;;81,0;0;0;0;26;4330;7760,0;3,04;Politik;6,5;2
zdSblctF2h0;Massive Luftangriffe auf Ukraine, mehrere Tote | ntv #shorts;03.01.2024 20:31;45;6046;34,0;76,17;7,0;0;10585;158;31;17;34,0;;0,5;0,2;4,1;0,4;10,4;1,3;15,2;3,8;23,2;7,7;33,1;;;316,0;0;0;0;32;17000;27472,0;2,46;Krieg;6,5;1
qaZ0J8Q7TXc;New York: The Portal nach Nackt-Aktion geschlossen | #ntv #shorts #newyork;15.05.2024 15:02;60;3633;45,0;76,19;2,0;0;4769;75;15;12;13,0;;1,8;;7,5;0,6;11,8;;11,8;4,7;20,4;11,9;29,7;;;412,0;0;0;0;15;6524;9491,0;4,58;Sonstiges;6,5;1
XnI0HmAZIYU;FDP-Politiker Dürr im #ntv Frühstart;29.10.2024 11:22;40;696;30,0;76,19;0,0;0;1372;36;9;4;7,0;;;;5,6;;7,0;;4,8;2,7;19,5;19,5;40,8;;;41,0;0;0;0;9;2391;10318,0;1,81;Politik;6,5;2
RIYVtuT1M-4;"""Aufprall mit 106 km/h: Franzose stellt """"Death Diving""""-Weltrekord auf | #ntv""";09.10.2024 10:48;45;1907;34,0;76,26;1,0;0;3335;37;7;27;6,0;0,7;4,7;2,5;15,4;1,4;22,0;;15,1;1,9;15,0;3,7;17,5;;;542,0;0;0;0;7;4312;12829,0;6,55;Sonstiges;7,5;1
tkb4XiwCq7E;"""""""Ohne uns wäre der Linkeste im Bundestag Scholz"""" - Gregor Gysi (Die Linke) im ntv Frühstart | #ntv""";21.02.2024 11:17;36;11864;27,0;76,29;16,0;1;25918;616;99;96;0,0;;0,5;0,3;1,9;0,8;5,3;1,8;9,7;6,2;23,3;16,1;33,9;;;1618,0;0;0;0;99;46164;19540,0;3,88;Politik;6,5;2
MPfVoZ3XoyM;Was glaubt ihr, was es mit dem #Monolith auf sich hat? #ntv #shorts;20.06.2024 09:54;48;8684;36,0;76,54;8,0;1;14183;188;40;59;27,0;;1,2;0,3;5,2;1,3;9,0;2,2;11,2;6,4;21,2;13,7;28,3;;;198,0;0;0;0;40;20859;17991,0;3,39;Sonstiges;7,5;2
x7n0AKJazT8;Ukrainischer Geheimdienst postet Video: Russisches Transportflugzeug geht in Flammen auf | #ntv;14.10.2024 12:23;38;3385;29,0;76,65;0,0;0;6973;180;25;10;15,0;;1,5;;3,5;0,5;7,6;1,1;10,5;3,5;23,1;11,3;37,4;;;76,0;0;0;0;25;9823;43079,0;4,29;Krieg;6,5;1
drRlhbyjVj0;Trump könnte er der erste Präsident der USA werden, der aus dem Gefängnis heraus regiert? | ntv;01.11.2024 13:30;53;22113;40,0;76,72;10,0;0;32630;490;234;181;209,0;0,2;1,9;0,6;4,8;0,9;6,8;2,1;9,0;5,9;19,7;16,0;32,1;;;1181,0;0;0;0;234;37184;290292,0;2,89;Politik;6,5;1
O27JwTcssLU;Das letzte Video von Nawalny zeigt ihn scherzend in seiner Zelle | ntv;17.02.2024 13:36;54;28303;41,0;76,73;24,0;5;40988;263;98;135;0,0;2,5;9,0;4,7;15,2;6,7;10,7;7,4;7,0;11,4;6,8;12,3;6,3;;;19066,0;0;0;0;98;0;946594,0;2,88;Politik;8,0;3
R9jKPTpxOp8;Sie kämpfen an der Seite der Ukrainer: Freiwillige aus den USA | #ntv #auslandsreport;14.11.2024 11:49;47;33280;36,0;76,86;25,0;1;55274;1009;237;193;186,0;0,0;4,6;0,2;10,4;0,5;14,3;0,8;15,7;1,7;23,9;4,1;23,7;;;1251,0;0;0;0;237;82939;189941,0;6,13;Krieg;6,5;1
RRUAEjto5Uw;Ukraine schießt russisches Kampfflugzeug ab | #ntv #shorts #ukraine #russland;23.07.2024 15:26;58;52633;44,0;76,96;43,0;3;70751;860;248;96;133,0;0,0;0,5;0,2;2,4;0,5;6,3;1,4;10,6;4,6;25,0;9,8;38,6;;;9039,0;0;0;0;248;80972;78083,0;6,3;Krieg;6,5;1
VTyfSWZbEc8;Was tun gegen starke AfD? ntv-Reporterin Kuhnert bringt es auf den Punkt | #ntv #shorts;22.01.2024 15:30;37;4684;28,0;77,06;13,0;2;9858;186;288;29;0,0;0,2;0,9;0,3;3,0;0,6;5,7;1,5;9,8;5,4;37,5;10,3;24,8;;;956,0;0;0;0;293;16206;20148,0;7,1;Politik;6,5;2
sHbbSlJ6Ap8;"""""""Das wird jetzt ganz schwierig"""",  Michael Roth (SPD) im #ntv Frühstart""";07.11.2024 12:25;52;7026;40,0;77,28;1,0;1;10491;151;65;27;40,0;;0,6;0,3;2,5;0,4;6,1;1,8;8,1;6,6;19,7;19,0;34,8;;;263,0;0;0;0;65;12774;39578,0;4,56;Politik;5,5;2
MpQMEaZ0AM4;Peru: Isoliertes indigenes Volk von Regenwald-Abholzung bedroht | #ntv #shorts #peru #indigenous;18.07.2024 10:29;48;6981;37,0;77,36;4,0;0;11282;206;12;43;32,0;0,2;2,4;1,0;9,7;0,8;12,9;1,2;14,2;3,8;24,0;5,3;24,7;;;966,0;0;0;0;12;17976;14886,0;4,38;Sonstiges;6,5;1
10pCRMarmQo;"""Reporter aus Washington: """"Trump hatte das damals boykottiert"""" | #ntv""";06.11.2024 13:32;58;8065;44,0;77,41;4,0;1;10778;143;24;22;11,0;;0,8;0,3;3,4;0,8;5,5;1,8;7,4;6,8;18,9;20,4;34,0;;;125,0;0;0;0;24;15543;85718,0;5,68;Politik;6,5;1
mWWfXinVSb0;Nach Aussage bei ntv: FDP-Generalsekretär Djir-Sarai tritt zurück | #ntv;29.11.2024 13:36;49;1436;37,0;77,44;0,0;0;2271;37;5;6;17,0;;3,3;;7,4;;9,3;0,9;8,4;4,1;19,5;16,1;31,0;;;48,0;0;0;0;5;3182;26138,0;3,0;Politik;6,5;2
BWYe3SxO5z0;"""""""Die Menschen wählen die AfD auch aus Protest"""" - Kai Wegner, Bürgermeister Berlin im Frühstart #ntv""";12.02.2024 11:06;46;27594;35,0;77,63;20,0;0;46366;730;802;166;0,0;0,1;0,6;0,3;2,5;1,0;6,4;2,4;11,1;8,3;25,3;14,6;27,4;;;3312,0;0;0;0;802;66344;31093,0;3,31;Politik;6,5;2
O0jLHKB-SE0;Überwachungsvideo zeigt brutalen Überfall-Versuch von Fake-Postboten | #ntv;05.11.2024 11:50;46;2765;35,0;77,68;1,0;0;4643;86;5;146;27,0;;3,3;1,8;12,3;2,8;18,8;2,5;12,5;4,4;16,0;7,9;17,7;;;667,0;0;0;0;5;4965;21087,0;6,28;Sonstiges;6,5;1
2B2R3cSnhK8;"""""""Wer bei [Scholz] Führung bestellt, bekommt gar nichts"""", Jens Spahn (CDU) im #ntv Frühstart""";11.11.2024 10:26;48;21580;37,0;77,73;9,0;0;34705;813;82;79;91,0;;0,6;0,4;2,8;0,9;5,4;2,2;7,7;7,7;20,6;20,6;31,2;;;546,0;0;0;0;82;57243;65048,0;5,13;Politik;6,5;2
2j6DuVxDTZA;Indien: Brennendes Auto gerät ins Rollen - Schaulustige fliehen | #ntv;15.10.2024 14:47;51;10966;39,0;77,89;6,0;0;16563;196;25;54;13,0;;1,0;0,3;4,5;1,3;8,7;1,8;10,5;5,2;22,9;11,6;32,0;;;546,0;0;0;0;25;21235;31358,0;4,42;Sonstiges;6,5;1
fLM5H-_R3nA;So schützt ihr euch besser vor Einbrechern | #ntv #shorts #news #einbruch;27.09.2024 14:52;48;3299;37,0;0,0;4,0;1;5295;100;8;16;10,0;;2,5;0,6;7,9;0,7;9,4;1,8;9,4;5,2;18,5;16,0;28,1;;;219,0;0;0;0;8;8577;21740,0;1,81;Sonstiges;6,5;1
pNpqCmzfOlg;Die ganze Folge ist jetzt auf unserem Kanal | #shorts #ntv #faktenzeichen #verschwörung;06.08.2024 16:18;53;5732;41,0;78,05;6,0;0;8315;131;30;16;16,0;0,3;1,6;0,6;4,6;0,8;8,4;2,4;9,9;7,6;20,7;17,4;25,6;;;220,0;0;0;0;30;12623;20445,0;2,97;Sonstiges;4,5;1
mEhmKiuB0t4;Als SPD sind wir da besonders laut - Katja Mast (SPD) zum Mindestlohn im #ntv Frühstart;23.05.2024 10:15;56;1400;43,0;78,13;3,0;1;1921;21;17;4;0,0;;;;9,8;;8,4;;9,7;4,5;18,0;15,4;34,3;;;127,0;0;0;0;17;4048;13669,0;3,15;Politik;6,5;2
o5BNPu_ukfw;Frisch renovierte Luxusjacht läuft mit Wasser voll | #ntv #shorts #yacht;02.08.2024 14:36;49;7917;38,0;78,18;8,0;0;12401;135;22;60;23,0;;0,6;0,1;3,5;0,6;7,5;1,4;9,3;5,0;22,0;14,1;35,8;;;335,0;0;0;0;22;14970;23226,0;4,37;Sonstiges;6,5;1
7PCdY4x3ZV8;Hinweise nimmt jede Polizei oder das LKA unter der Nr. +49-(0)511 9873-7400 entgegen. #shorts #ntv;12.09.2024 18:18;41;1706;32,0;78,18;0,0;0;3195;53;7;4;5,0;;4,7;;8,5;0,9;10,3;1,9;11,7;6,3;17,8;14,8;23,2;;;101,0;0;0;0;7;4713;33850,0;3,45;Sonstiges;6,5;2
2s7WsAD3nxc;Den ganzen Talk haben wir euch hier verlinkt | #ntv #shorts #thüringen #wahl #osten;28.08.2024 22:31;51;2374;39,0;78,26;2,0;0;3570;63;19;5;14,0;;1,1;;4,5;;8,7;1,5;8,8;7,2;19,2;18,6;30,4;;;56,0;0;0;0;19;4807;24381,0;3,09;Politik;5,5;1
U1y4EmV2fVk;"""""""Keine Bürgergelderhöhung, und das ist auch richtig"""" - Hubertus Heil (SPD) im #ntv Frühstart""";04.09.2024 12:14;52;2621;40,0;78,38;0,0;0;3859;46;19;6;30,0;;1,5;;3,3;0,6;5,1;0,7;10,8;7,7;22,3;17,9;30,2;;;98,0;0;0;0;19;5596;28427,0;2,96;Politik;6,5;2
Z0ZDQnOFhK0;Abgekupfert? Lindner witzelt über Habecks Video | #ntv;08.11.2024 13:54;46;4878;36,0;0,0;4,0;0;8106;103;30;49;27,0;0,4;3,1;0,6;11,3;1,5;13,4;2,4;10,9;7,2;14,5;14,1;20,7;;;902,0;0;0;0;30;8035;70979,0;5,51;Politik;6,5;2
rWM9biLp7i8;"""""""Er ist schwach"""", Kamala Harris über ihren Kontrahenten Donald Trump #ntv""";16.10.2024 12:55;47;1625;36,0;78,51;0,0;0;2644;42;7;2;9,0;;2,3;;6,4;;6,6;1,2;6,8;3,3;14,7;22,0;36,9;;;223,0;0;0;0;7;3692;20495,0;2,95;Politik;6,5;1
6KRzmc8WeLg;Nahe Disneyland Paris: Kleinflugzeug verunglückt auf Autobahn in Frankreich | #ntv #shorts;01.07.2024 12:37;34;5378;26,0;78,62;7,0;0;12073;100;22;21;3,0;0,3;2,3;0,7;4,9;1,3;7,1;2,6;9,7;6,9;21,6;13,1;29,1;;4,0;540,0;0;0;0;22;18237;18343,0;2,26;Sonstiges;6,5;1
HNNh56ewzqg;"""""""Ich kämpfe gegen die Normalisierung des Faschismus"""" - Bodo Ramelow (Linke) im #ntv Frühstart""";14.08.2024 11:02;48;4552;37,0;78,68;4,0;0;7233;151;109;55;93,0;;1,9;;7,1;0,5;7,5;1,2;9,0;5,7;19,1;16,3;31,6;;;124,0;0;0;0;109;12246;40044,0;4,19;Politik;8,5;2
WuLtYZMGC6w;Alice Weidel, AfD, trifft zur Elefantenrunde bei ntv ein | ntv #shorts;09.06.2024 20:20;31;158600;24,0;78,77;271,0;11;389698;11941;576;375;723,0;1,3;6,7;3,3;16,1;4,6;15,8;5,0;11,2;6,9;11,9;7,5;9,2;1,0;2,0;34675,0;0;0;0;576;546964;379747,0;5,78;Politik;6,5;2
gAW5ARGaWO8;Vulkanausbruch auf Island: Lava erreicht bekannte Blaue Lagune | #ntv;22.11.2024 12:12;44;2604;34,0;78,77;3,0;0;4509;53;2;85;7,0;;4,0;1,4;11,5;2,7;15,5;2,1;11,0;8,4;15,2;11,2;16,9;;;992,0;0;0;0;2;5151;62567,0;2,47;Sonstiges;6,5;1
8MA11-r-1Pk;Rumänien: Wolf hinter Radfahrer her | #ntv #shorts #rumänien #wolf;26.04.2024 12:56;55;13764;43,0;78,9;12,0;1;19031;235;46;195;0,0;0,4;1,4;1,3;5,5;2,8;10,0;3,6;11,3;8,0;20,0;11,3;24,4;;;1354,0;0;0;0;46;26698;34350,0;5,16;Sonstiges;6,5;1
E7cgxsDtefc;"""Ampelregierung steht vor """"Woche der Entscheidung"""" - PART 1 | #ntv""";04.11.2024 11:39;55;6630;43,0;78,95;3,0;0;9162;126;35;31;37,0;0,2;1,7;0,7;6,3;1,0;7,0;1,7;7,2;6,5;18,2;18,4;31,1;;;251,0;0;0;0;35;11671;141304,0;2,31;Politik;6,5;2
5bFu40k4Yhs;Aufgeheizte Stimmung in USA könnte sehr gefährlich werden - Saskia Esken, SPD im #ntv Frühstart;15.07.2024 11:01;50;15213;39,0;78,99;9,0;0;23112;152;105;45;109,0;;0,9;0,4;2,9;0,8;5,6;1,7;9,2;6,6;21,8;16,6;33,5;;;165,0;0;0;0;105;28767;154071,0;7,31;Politik;6,5;2
CT9A3g8Q6gk;Sahra Wagenknecht, BSW, kommt zur Elefantenrunde | ntv #shorts;09.06.2024 20:22;41;10322;32,0;79,01;11,0;2;19119;307;24;28;23,0;1,3;6,2;3,4;14,4;3,8;14,3;4,5;11,6;7,0;12,9;8,6;11,9;;;1461,0;0;0;0;24;28122;81788,0;5,99;Politik;6,5;1
